,sentences,users,date,sentiment_score
2795,"receive, surat, cukai, tanah, elmina, valley, 2",s-one,"Mar 27 2018, 09:27 PM",0.0
2796,"bro, u, impatient, 1, 2, contribute, 2, sgor, govt, coffer, 😆, quit, rent, wait, till, 2, pay, time",BRE,"Mar 27 2018, 09:34 PM",-0.3818
2797,"monthly, income, 8k, plus, cover, 800k+, land, property",Croner,"Mar 27 2018, 09:53 PM",0.0
2798,"geh, ..., nett, income, 8k, geh, wa, ..., u, commitment, ..., u, gt, 4k, spend, ..., haha",aaron1717,"Mar 27 2018, 11:53 PM",0.7717
2799,"nett, income, 7k, commitment, bank.will, approve, loan, hear, nowadays, bank, 70",Croner,"Mar 27 2018, 11:54 PM",0.3818
2800,"credit, record, la, ..., commitment, ..., repayment, pattern, important, ..., whr, gt, nowadays, 70, ..., fren, buy, hse, year, ..., 90, loan, ..., perfect, ..., sure, approve, ..., 3k, u, spend, matter, ...",aaron1717,"Mar 28 2018, 12:06 AM",0.9217
2801,"think, know, questionnormally, bank, calculate, 70%~90, net, income, maximum, commitmentif, 8000, net, income, 70, 5600maximum, commitment, current, installment, relate, bank, example, car, personal, loan, house, installment, buyexample, current, car, installment, rm1500, personal, loan, rm1000, house, installment, 3600, total, 6100then, bank, reject, maximum, commitment, 5600, time, increase, payment, house, installment, drop, 3600, 3000, total, commitment, 5500, loan, high, chance, approve.hope, question, understand, poor, english, hehe",swn525,"Mar 28 2018, 03:20 PM",0.4939
2802,"thanks, bro",Croner,"Mar 28 2018, 05:35 PM",0.4404
2803,"bank, home, loan, calculator, calculate, eligibility, factor, bank, consider, repayment, pattern, etc.http://www.maybank2u.com.my/webbank/m2uhom...calculator.htmlhttps://www.rhbgroup.com/products-and-servi...flexi-home-loangood, luck",flyingrobot,"Mar 29 2018, 08:58 AM",0.4588
2804,"receive, letter, delivery, vp, elmina, valley, phase, 1, state, s, maintainance, charge, rm206, know, monthly",calcium206,"Mar 29 2018, 12:20 PM",0.0
2805,"bro, .., think, ur, consideration, buy, time, consider, late, ..., ev1, sell, 1, day, lauching, ..., ev2, 1, day, sell, type, b, ..., ev3, problem, sell, people, concern, temple, maybe, ..., ev4, sell, week, lauche, ...., u, consider, ..., definitely, available, unit, lolsure, end, corner, unit, leave, ..., u, banner, developer, unit"", ..., maybe, u, contact, ...",redalert,"Mar 29 2018, 01:28 PM",-0.0516
2806,"congras, state, month, f&g, definitely, monthly, fee, developer, manage, hand, ra",easywin3,"Mar 29 2018, 05:37 PM",0.7096
2807,"security, agreement, charge, sd, 1, 2, year, mistaken, .., need, check, security, agreement, ..",Don Shady,"Mar 29 2018, 05:53 PM",0.8271
2808,"guy, price, elmina, valley, intermediate, unit, size, 22, size, 24",BaRT,"Mar 29 2018, 06:18 PM",0.0
2809,"chance, touch, sa.my, friend, buy, new, unit, ev2, september, type, intermediate, unit, direct, sd, sell, price, 688, k, discount, free, mot, etc, merdeka, promo, cash, 10k, summore, unit, open, coz, previous, buyer, problem, loan, bank, time, ev1, 1, unit, leave, scenario, people, q, buy, guess, ev1, ev2, totally, sell, maybe, ev4, chance, la, ev3, available, u, mind, temple",BaRT,"Mar 29 2018, 06:40 PM",0.765
2810,"wanna, place, booking, unit, face, temple, fully, book",hiryuu,"Mar 29 2018, 07:31 PM",0.0
2811,info,1zR4eL,"Mar 29 2018, 10:39 PM",0.0
2812,https://www.simedarbyproperty.com/city-of-elmina,easywin3,"Mar 30 2018, 09:00 AM",0.0
2813,"weird, upcoming, launch, link",1zR4eL,"Mar 30 2018, 10:08 AM",-0.1779
2814,price,BaRT,"Mar 30 2018, 05:34 PM",0.0
2815,"sale, gallery, coz, parent, want, unit, left, ask, cny, promo, ..., pm, referal, fee, 😬",hiryuu,"Mar 31 2018, 04:46 PM",0.0772
2816,"buy, ..., money, downpayment, developer, unit",Croner,"Apr 1 2018, 04:16 PM",0.0
2817,"write, elmina, 100, flood, guarantee, sorry, bad, knowledge, means?i, buy, ev2, notice, group, nice, meet",keithchen99,"Apr 2 2018, 08:13 AM",0.0
2818,"basically, area, flood, prevention, plan, .., s, extreme, flood, .., central, park, flood, catchment, area, accord, sdb, la, .., prove, .., lol",corboylee,"Apr 2 2018, 09:15 AM",0.4215
2819,"refer, past, post, happen, 1, flood, 1000, year, flood, happen, rate, 0.1, yearhttps://forum.lowyat.net/index.php?showtopi...post&p=86295276",elmond,"Apr 2 2018, 09:39 AM",0.0
2820,"hey, guy, want, sell, ev, phase, 1, price, rm650, k, unit, good, location, key, collect, week, let, know, interested, view, house, tqvm",chewingun,"Apr 2 2018, 11:24 AM",0.7096
2821,"sneak, peek, ev3a, 20x60",rekrazie,"Apr 2 2018, 11:35 AM",0.0
2822,"yr, dream, house, ah?intend, rip, apart, floor, tile, replace, w, yr",BEANCOUNTER,"Apr 2 2018, 11:44 AM",0.25
2823,"row, umine, row, house, 2, ev3b, sebelah, big, corner, lot, ..., face, hutan, guess, ..., sawit, somethg, 😅",sham ka,"Apr 2 2018, 11:52 AM",0.0
2824,"area, point, map, forgot, undeveloped, area, elmina",elmond,"Apr 2 2018, 11:53 AM",0.0
2825,"post, 😊, .am, new, forum, ..., sorry, ..., tunjuk, ajar, ku, sifu, 😊",sham ka,"Apr 2 2018, 12:27 PM",-0.0772
2826,"good, view, face, main, road, 10, year",elmond,"Apr 2 2018, 12:28 PM",0.4404
2827,,sham ka,"Apr 2 2018, 01:47 PM",0.0
2828,"house, face, park, temple, near",elmond,"Apr 2 2018, 02:51 PM",0.0
2829,"far, bro, ..., unit, nice, view, uphill, look, park, ..., envy, ..., haha",hiryuu,"Apr 2 2018, 04:13 PM",0.5719
2830,"far, bro, ..., unit, nice, view, uphill, look, park, ..., envy, ..., haha",hiryuu,"Apr 2 2018, 04:44 PM",0.5719
2831,"oh, ya, kai, know, ..., husband, buy, time, tak, sempat, choose, quickly, book, coz, time, previous, lauch, sell, fast, grab, unit, available",sham ka,"Apr 2 2018, 04:48 PM",0.0
2832,"oops, address, madam, bro, 🤭, visit, showroom, weekend, sa, tell, build, tall, wall, unit, face, temple, unit, face, temple, guess, worry, dunno, depend, individual, ..., mind, ..., way, far, ..., 😅, hope, build, nice, mosque, elmina, like, bukit, jelutong, ara, damansara",hiryuu,"Apr 2 2018, 05:32 PM",0.6486
2833,"u, want, sell, ask",lancengchai84,"Apr 2 2018, 06:16 PM",0.0772
2834,"photo, actual, unit, ev2, type, b1, b2, wonder, look, like, bedroom, face, porch, instead, living, room",rookienyc,"Apr 2 2018, 10:22 PM",0.3612
2835,"dun, need, ask, obvious, lah, ..., u, think, u, honest, answer",BEANCOUNTER,"Apr 2 2018, 10:52 PM",0.5106
2836,"num, 4, big, corner, house, ...",papahandsome,"Apr 3 2018, 05:57 AM",0.0
2837,"sale, gallery, today, sa, tell, alarm, air, con, piping, provide, ferrea, confirm",alextyw85,"Apr 3 2018, 10:33 AM",-0.34
2838,"confirm, wheter, elmina, phase, 2a, aircond, piping",Don Shady,"Apr 3 2018, 10:35 AM",0.0
2839,"pass, elmina, like, exisitng, taman, fence, y, developer, build, it?the, guard, facility",rainman19,"Apr 3 2018, 03:47 PM",0.3612
2840,"pass, elmina, exist, taman, fence, y, developer, build, it?the, guard, facility",rainman19,"Apr 3 2018, 03:49 PM",0.0
2841,"pass, elmina, exist, taman, fence, y, developer, build, it?the, guard, facility",rainman19,"Apr 3 2018, 03:51 PM",0.0
2842,"ask, question, sa, mention, sd, 1, year, key, build, guard, house, state, s&p",hiryuu,"Apr 3 2018, 03:54 PM",0.0
2843,"sd, build, fence, year",alextyw85,"Apr 3 2018, 05:40 PM",0.0
2844,"mbsa, rule, state, need, 75, resident, agree, fencing, need, resident, sign, letter, build, fence",fadzlie,"Apr 3 2018, 06:35 PM",0.3612
2845,https://www.thestar.com.my/metro/community/...but-ras-say-it/,Farhan Matic,"Apr 3 2018, 06:41 PM",0.0
2846,"thank, share, article.100, approval, require, auto, gate75, manual",BEANCOUNTER,"Apr 3 2018, 08:56 PM",0.7783
2847,"let, hope, achieve, want, gate, right, 😅",hiryuu,"Apr 3 2018, 09:18 PM",0.4939
2848,"u, guy, sign, dmc, purchase, property?if, ...., hard, achieve, 70, auto, gate, bcos, thoae, stay, want, pay, extragood, luck",BEANCOUNTER,"Apr 3 2018, 09:34 PM",0.3612
2849,"year, plus, phase, achieve, 75, ...., s, luckily, alot, stayer, ..., investor, phase, ..., good, luck, god, bless, liao, ....",aaron1717,"Apr 3 2018, 10:21 PM",0.9201
2850,"elmina, green, direct, access, guthrie, highway, way, look, project, possible, main, entrance, ..., distance, guthrie, ..., peak, hour, ..., pesiaran, elmina, jalan, paip, guthrie, god, damn, jam, ....",aaron1717,"Apr 3 2018, 11:18 PM",-0.1531
2851,"fencing, allow, individual, title, land, elmina, safe, place, stay, think, build, guardhouse, barrier, sufficient, ....",alextyw85,"Apr 3 2018, 11:19 PM",0.5106
2852,"confirm, near, future, sd, set, 2035, year, review, gce, connection",elmond,"Apr 4 2018, 09:04 AM",0.0
2853,"hi, guy, want, sell, ev2, price, rm715k, unit, good, location, nice, number, vp, expect, month, apr, .., let, know, interested, view, unit, thank",wkchin29018,"Apr 4 2018, 10:32 AM",0.8885
2854,"wa, bro, ..., citizen, 2, till, elmina, ka, ...., generally, phase, elmina, fence, ..., think, long, approval, ..., f&g, possible, ...., impossible, restrict, thoroughly, ....",aaron1717,"Apr 4 2018, 10:35 AM",0.128
2855,"wa, ..., kesian, bsu, eg, user, cramp, small, road, gce, exit, ...., crazily, jam, ..., progress, eg, fast, ....",aaron1717,"Apr 4 2018, 10:55 AM",-0.128
2856,"elmina, green, connect, elmina, valley, cramp, doubt, open, eg, vp.basically, free, 1, toll, pack, road, predict, jam, effect, persiaran, e1/1",elmond,"Apr 4 2018, 11:12 AM",0.0
2857,"yea, ..., look, ..., s, way, ...., pesiaran, elmina, jam, everyday, ...., new, development, vp, ..., exit, pmd, viable, option, puncak, alam, resident, anymore, ....",aaron1717,"Apr 4 2018, 11:16 AM",0.0
2858,pm,SS25,"Apr 4 2018, 01:08 PM",0.0
2859,"basically, think, ev3, somewhat, gated, fence, 100%.considering, wall, build, cover, temple, ev3, locate, slightly, uphill, unfenced, area, impossible, ...",hiryuu,"Apr 4 2018, 02:44 PM",0.0
2860,"haha, malaysians, fence, ..., berpisah, tiada, ..., sigh",empatTan,"Apr 4 2018, 02:48 PM",0.4767
2861,"u, sure, ethan, hunt",BEANCOUNTER,"Apr 4 2018, 02:51 PM",0.3182
2862,"curious, price, ferrea, liana",MasBoleh!,"Apr 4 2018, 02:54 PM",0.3182
2863,"f, n, g, ev3, 20, x, 60, 22, x, 75, 24, x, 75, temple, area",sham ka,"Apr 4 2018, 03:10 PM",0.0
2864,"sa, tell, early, ev3, area, come, fence, guard, ev3, buyer, sign, security, agreement, mistaken",Izzy123,"Apr 4 2018, 03:20 PM",0.4767
2865,"yes, 1st, batch, original, buyer, wont, subsale, collection, maintenance, problem, macam, usj, ....",BEANCOUNTER,"Apr 4 2018, 06:43 PM",0.3182
2866,"bro, ...",hiryuu,"Apr 5 2018, 12:05 AM",0.0
2867,"wall, temple, area, mistaken, rest, fence, ...",hiryuu,"Apr 5 2018, 12:19 AM",-0.3612
2868,"guy, want, consult, i’m, currently, consider, elmina, ev3, ijm, bukit, rimbayu, advise, confident, future, development, bukit, rimbayu, familiar, ev",Sleepfoomuch,"Apr 5 2018, 09:09 AM",0.5423
2869,"workmanship, major, defect",easywin3,"Apr 5 2018, 09:18 AM",-0.34
2870,"confident, rimbayu, bukit.for, price, similar, house, elmina",elmond,"Apr 5 2018, 09:43 AM",0.4939
2871,"choose, familiar, lo",kh8668,"Apr 5 2018, 09:52 AM",0.0
2872,"bandar, rimbayu, 7mtr, sea, level, nia, ground",BEANCOUNTER,"Apr 5 2018, 10:01 AM",0.0
2873,"u, find, fact, 7, m",mingyew,"Apr 5 2018, 10:04 AM",0.0
2874,"section, 14, pj, ...",empatTan,"Apr 5 2018, 10:09 AM",0.0
2875,"rimbayu, thread, software, check, think, low, 4, m, report, read, rimbayu, build",BEANCOUNTER,"Apr 5 2018, 10:11 AM",-0.2732
2876,"freehold, vs, leasehold, ..., elmina, easy, access, directly, guthrie, ..., future, dash, nearby, ..., rimbayu, leasehold, ada, apa, direct, access, highway, ..., commercial, activity, abang, adik, ..., compare, factor, ...",aaron1717,"Apr 5 2018, 11:24 AM",0.5574
2877,"try, website, suppose, 14mrimbayuhttp://www.floodmap.net/?ll=2.94626,101.55657&z=12&e=14elmina, valleyhttp://www.floodmap.net/?ll=3.175152,101.508779&z=11&e=47",elmond,"Apr 5 2018, 11:45 AM",0.0
2878,"check, telok, panglima, garang, rimbayu",mingyew,"Apr 5 2018, 02:38 PM",0.0
2879,"4, m, report, read, year, ago.but, post, link, 7, m, safety, zone, 6m, rimbayu, 14, m, need, visit, sale, gallery, confirm, architectural, drawing, figure",BEANCOUNTER,"Apr 5 2018, 02:40 PM",0.4215
2880,"ok, wait, feedback, fyi, rimbayu, ex, land, small, hill",mingyew,"Apr 5 2018, 02:47 PM",0.4588
2881,"decide, buy, ev, consider, bukit, rimbayu, too.these, factor, compare, 2:-, work, pj, ev, near, me-, ev, freehold, rimbayu, leasehold-, size, build, property, ev, cheap, think, ev, difficult, chinese, food, big, deal, surely, dinner, pj, home, ev-, chinese, school, problem, child, environment, buy, stay, investment, ev, comfortable, forest""future, development, big, concern, excited, elmina, city, center, thought",OliviaWong17,"Apr 7 2018, 07:26 AM",0.6249
2882,"rimbayu, new, project, ijm, buy, road, builder, project, design, canal, city, road, builder, day, know, majority, area, sit",PACINO,"Apr 7 2018, 08:42 PM",0.0
2883,"choice, ..., lol, ..., rimbayu, near, kk, city, need, 10, min, ba, chinese, restaurant, ..., difference, u, travel, kampung, subang, subang, chinese, food, elmina, ...., canal, city, amenity, moment, ...., apply, elmina, ....",aaron1717,"Apr 7 2018, 11:12 PM",0.6486
2884,"worry, abt, commercial, activity, canal, city, matter, time.with, 4, cina, developer, compare, 1, national, developer, think, township, flourish, commercial",BEANCOUNTER,"Apr 9 2018, 08:38 AM",-0.4215
2885,"..., look, sdb, ...., good, elmina, flourish, time, ad, flourish, ..., lol, ...., ..., alot, thing, predict, accurately, ..., look, guy, want, right, ..., lol",aaron1717,"Apr 9 2018, 09:32 AM",0.8316
2886,"area, face, land, area, build, mosque, fencing, indian, temple, doubt, sd, build, fencing, entire, ev3, ..",alextyw85,"Apr 9 2018, 09:43 AM",-0.3612
2887,"rimbayu, leasehold, elmina, freehold, think, location, rimbayu, convenience, u, dine, banking, etc, kemuning, elmina, far, hypermarket, mcd, kfc, pizza, hut, indian, mamak, ...., air, quality, sure, rimbayu, air, smoke, smell, night, night, sure, ...",alextyw85,"Apr 9 2018, 10:12 AM",0.6486
2888,"good, comment, ...",alextyw85,"Apr 9 2018, 10:35 AM",0.4404
2889,"phase, buy, ev3, rebate, ev3, intermediate, unit, ev4",alextyw85,"Apr 9 2018, 10:36 AM",0.0
2890,"bro, malay, cemetery, reserve, land, eg, elmina, master, plan, plan, buy, choice, house, carefully, ...",alextyw85,"Apr 9 2018, 10:37 AM",0.128
2891,"hey, bro, buy, c2, time, plan, buy, investment, elmina, stay, ...",alextyw85,"Apr 9 2018, 02:54 PM",0.0
2892,"actually, fence, high, indian, temple, ...., forget, future, malay, mosque, build, land, ....",alextyw85,"Apr 9 2018, 03:32 PM",-0.2263
2893,"haha, la, balik, rumah, occasionally, pass, ..., road, access, limited, ..., wanna, know, gt, direct, exit, ..., super, jam, eg, complete, ...., owhh, ..., far, elmina, rimbayu, preferred, choice, mind",aaron1717,"Apr 11 2018, 11:42 AM",0.7964
2894,"buy, ev4, buy, ev3, becos, like, courtyard.u, sale, gallery, check, available, unit, far, know, ev3, unit, available",OliviaWong17,"Apr 11 2018, 12:50 PM",0.3612
2895,"hi, sure, mean, hight, refer, previous, post, 2764, actual, photo, future, mosque, build, land, idea, specific, land",tzuen,"Apr 11 2018, 03:50 PM",0.3182
2896,"look, masterplan, ’, indicate, observation, aeropod, ’, outside, ev3, nearby, petronas, guess",hiryuu,"Apr 13 2018, 08:42 AM",0.0
2897,"buyer, ferrea",melody417,"Apr 13 2018, 08:44 AM",0.0
2898,"mosque, confirm, build, near, future, masjid, al, faridee, denai, alam, think, land, reserve, mosque, near, bukit, subang, elmina, valley, surau, reserved, masterplan",elmond,"Apr 13 2018, 09:00 AM",0.0
2899,"yes, ..., mosque, build, near, petronas.one, thing, mosque, malay, muslim",SS25,"Apr 13 2018, 09:01 AM",0.4019
2900,"yeah, remember, sa, tell, confirm, project, receive, greenlight, proceed, surau, near, petronas, sense",tzuen,"Apr 13 2018, 09:20 AM",0.296
2901,"ev1, owner, update, key, collection",awie666,"Apr 13 2018, 10:10 AM",0.0
2902,"guess, different, piece, information, coz, sa, tell, ’, masjid, await, state, gov, approval, ...",hiryuu,"Apr 13 2018, 10:17 AM",0.5423
2903,"probably, sa, confuse, diff, surau, masjid",tzuen,"Apr 13 2018, 10:27 AM",-0.2263
2904,"haha, know, long, fund, masjid, denai, alam, know, mosque, nearby, bukit, subang, elmina, valley.it, matter, area, coverage, funding.from, current, development, plan, 4, need, mosque, elmina, denai, alam, elmina, east, elmina, green, elmina, city, centre.it, coincidence, elmina, vakkey, 3, mosque",elmond,"Apr 13 2018, 10:33 AM",0.4767
2905,"bring, big, unit, ferrea, denai, alam, think, want, let",chewingun,"Apr 13 2018, 10:38 AM",0.0772
2906,"look, like, rimbayu, elmina, term, township, planning, location, abang, adik, ..., ev3, look, nice, future, mosque, right, ev3, land, know, build, ..., wife, like, ev3, like, rimbayu, instalment, pay, think, choice, like, wife, black, face, everyday, ..., rimbayu, 2, small, mall, elmina, think, die, stay, ..., kid, ...",alextyw85,"Apr 13 2018, 10:52 AM",0.7579
2907,"right, reserve, land, mosque, petronas, reserve, land, mosque, big, base, late, master, plan, clinic, kesihatan, ev3, mosque, wonder, 1malaysia, clinic, ..., know, clinic, big, land, ...",alextyw85,"Apr 13 2018, 10:57 AM",0.0
2908,"sorry, fence, high, high, stand, ev3, room, upper, indian, temple, maybe, sd, build, fence, lagi, high, block, view, ...",alextyw85,"Apr 13 2018, 11:02 AM",-0.4939
2909,"hahaha, ..., hm, u, forever, leh, ...., need, consider, delicate, balance, ..., lol, ..., elmina, major, mall, exactly, hard, ..., small, mall, rimbayu, matter, ..., think, accessibility, wise, elmina, slightly, ..., guthrie, actually, good, use, access, city, ..., dash, add, benefit, location, ...., wanna, look, chinese, food, ..., kampung, subang, subang, bestari, ..., glenmarie, pun, ada, ..., basic, grocery, shopping, ..., place, abang, adik, ..., need, 10, min, buy, affordable, daily, stuff, ...., wanna, movie, ..., rimbayu, drive, sunway, watch, ..., elmina, u, drive, space, u8, bukit, jelutong, ..., 15, min, reach, cinema, seldom, ..., lolz",aaron1717,"Apr 13 2018, 11:28 AM",0.9082
2910,"wow, insider, news, sd, staff, need, mosque, township, curious, ...",alextyw85,"Apr 13 2018, 11:31 AM",0.7269
2911,"bro, let, reason?22, 75, phase, 2, think, sign, s&p, let",alextyw85,"Apr 13 2018, 11:39 AM",0.0
2912,"thank, advise, bro, ..., wife, ma, fan, .., ask, decision, end, listen, know, ask, decision, listen, ..., want, argue, parent, son, ..., way, gamuda, 257, mbo, need, sunway, movie, ...",alextyw85,"Apr 13 2018, 11:54 AM",0.4019
2913,"usual, sdp, build, amenity, early, phase, ara, d, good, example, amenity, 1991, 1995, early, phase, usj, elmina, 8, 10, year, potential, elmina, city, buy, elmina, property, mainly, kid, strongly, believe, kid, afford, landed, house, kv, 5, 6, year, like, stay, elmina, sale, property, freehold",utellme,"Apr 13 2018, 05:27 PM",0.802
2914,"oh, ..., din, realize, 257, gt, cinema, ..., good, thing, ..., haha, ..., work, ..., place, fast, wife, ..., haha, ..., woman, like, ..., let, u, decision, easily, ..., hahaha, ..., tolerate, abit, je, lo, ..., brainwash, vital, ....",aaron1717,"Apr 13 2018, 09:03 PM",0.9623
2915,"subsale, ard, 690k, 20x70, customer, buy, subsale, like, elmina, potential, near, kwasa, ..., need, 8, yrs, reap, ....",Neoyo,"Apr 13 2018, 10:28 PM",0.3612
2916,"690, k, subsale, 20x70, new, launch, 22x70, denai, alam, 780, k, come, rebate, sdp",utellme,"Apr 14 2018, 07:00 AM",0.0
2917,"oh, ask, question, sa, right, current, wall, ..., like, ooh, sureeee, ..., haha",hiryuu,"Apr 14 2018, 08:29 AM",0.6705
2918,"seriously, understand, especially, d, point",empatTan,"Apr 14 2018, 08:29 AM",-0.1779
2919,"point, subsale, leasehold, property, difficult, sale, compare, freehold, property",utellme,"Apr 14 2018, 08:29 AM",-0.2023
2920,"leasehold, cup, tea, people, nowadays, leasehold, freehold, different, come, sub, sale, tell, difference",Izzy123,"Apr 14 2018, 01:43 PM",0.1779
2921,"learn, lesson, leasehold, property, difficult, let, 30, year, old, property, subsale, market, location, good",utellme,"Apr 14 2018, 01:45 PM",0.1027
2922,"dunno, ..., mayb, enuff, survey, ...",Neoyo,"Apr 14 2018, 03:44 PM",0.0
2923,"lh, land, ...., ok",Neoyo,"Apr 14 2018, 04:03 PM",0.296
2924,"build, fencing, like, meh, extend, fencing, .., time, hear, ..., hehehehe, ...",alextyw85,"Apr 14 2018, 07:17 PM",0.4404
2925,"know, right, ..., scepticsm, ’, tell, sa, yelah, tu, ...",hiryuu,"Apr 14 2018, 07:35 PM",0.0
2926,hahaha,sham ka,"Apr 15 2018, 07:35 AM",0.5574
2927,"garinia, elmina, 24, x, 79, double, storey, terrace, intermediate, unit, market, price",AskarPerang,"Apr 15 2018, 11:07 AM",0.0
2928,"mind, area, fencing, guard, not.have, stay, guard, place, place, face, housebreak, burglary, issue, guard, round, check, night.pity, victim, lose, money, guard, fee, lose, money, robbery",pjol,"Apr 15 2018, 02:14 PM",-0.7579
2929,"lifelong, effect, mentally",BEANCOUNTER,"Apr 15 2018, 08:58 PM",0.0
2930,"hear, lelong, unit, start, come, elmina, hold, bullet",thenazek,"Apr 15 2018, 09:37 PM",0.0
2931,"mana, dapat, news, gt, like, rawang, cyberjaya",aaron1717,"Apr 16 2018, 09:11 AM",0.5574
2932,"lelong, unit69, jalan, frekuensi, u16/131, elmina, east, 40160, shah, alam, selangorgarinia, 24, x, 79built, area, 2,703, sq, ftintermediate, unit, 2, storey, terracereserve, price, 🔥, 🔥, rm, 774k, 🔥, 🔥, freeholdauction, 24/4/18not, actual, unit, pic, example",AskarPerang,"Apr 16 2018, 11:18 AM",0.0
2933,"eye, wait, middle, end, hehe",thenazek,"Apr 16 2018, 11:19 AM",0.0
2934,"sub, sale, unit, unit, face, east, west, living, room, kinda, warm, morning, kitchen, hot, noon, plan, 24/7, aircond",tzuen,"Apr 16 2018, 12:02 PM",0.1548
2935,"house, address, garinia, phase, build, wrong",utellme,"Apr 16 2018, 04:58 PM",-0.4767
2936,"address, betul, actual, build, area, 23xx, buddy, unit, garinia, .., sapu, sapu, ..., cheap",utellme,"Apr 17 2018, 03:22 PM",0.0
2937,"garinia, unit, land, size, 24x79, consider, superlink, type, 820, k, cheap",utellme,"Apr 17 2018, 03:25 PM",0.0
2938,"spend, money, secure, asset, suffer, lose, burglar.eg, solid, door, security, grill, cctv, alarm, lock, motion, detector, think",easywin3,"Apr 18 2018, 02:19 PM",-0.1779
2939,"think, install, grill, ...., guard, alarm, provide, house, look, grill, important, close, neighbour, help, watch, alarm, trigger",Izzy123,"Apr 18 2018, 02:59 PM",-0.0772
2940,"cheap, sapu, 😁, 😉",Izzy123,"Apr 18 2018, 03:03 PM",0.0
2941,"agree, hopefully, neighbor, nearby, buy, stay",easywin3,"Apr 18 2018, 03:16 PM",0.6369
2942,"think, install, grill, ...",hiryuu,"Apr 18 2018, 03:46 PM",0.0
2943,"install, mosquito, net, security, feature",kh8668,"Apr 18 2018, 04:07 PM",0.34
2944,"look, nice, right, oh, .., thing, necessary",hiryuu,"Apr 18 2018, 06:08 PM",0.4215
2945,"bro, normally, auction, price, high, reserve, price, right, let, additional, rm, 100, k, bid, price, pay, rm, 870, k, different, buy, new, house, elmina?and, additional, cost, auction, unit",alextyw85,"Apr 19 2018, 08:52 AM",-0.1027
2946,"unit, 2nd, auction, auction, 860k, auction, usually, market, valuation, today, soft, slow, market, certainly, cheap, price, auction, price, subsale, drop, 10, round, sold, statement, 100k, increase, logical, bidder, smart, subsale, selling, 870k, bid, reach, subsale, pricing, cost, buy, subsale, valuation, fee, legal, fee, stamp, duty",AskarPerang,"Apr 19 2018, 09:05 AM",0.7096
2947,"consider, buy, ..., auction, place",alextyw85,"Apr 19 2018, 10:50 AM",0.0
2948,"unit, brand, new, vp",topearn,"Apr 19 2018, 02:37 PM",0.0
2949,"yesterday, elmina, valley, tent, instal, ev1, ..., handover, key, ceremony, tomorrow, security, guard, ...",Don Shady,"Apr 19 2018, 02:41 PM",0.34
2950,"wao, handover, key, ceremony",melody417,"Apr 19 2018, 02:54 PM",0.0
2951,"maybe, coz, ev, home, owner, sime, darby, wanna, hype",hiryuu,"Apr 19 2018, 03:11 PM",0.0
2952,"wow, ..., good, ..., welcome, owner, ..., tenant, ev, ...., ev2, people, ...., think, ev1, ev2, month, gap, ..",redalert,"Apr 19 2018, 03:16 PM",0.8658
2953,"discussion, ev, wonder, elmina, gardens, owner",kinseong,"Apr 19 2018, 03:30 PM",0.0
2954,"elmina, gardens, wa, group",meonkutu11,"Apr 19 2018, 03:41 PM",0.0
2955,"yes, 2, wa, group-, elmina, gardens, individual, phase",utellme,"Apr 19 2018, 03:58 PM",0.4019
2956,"oh, discussion, active, wa, group?i, join, fb, group, quiet",kinseong,"Apr 19 2018, 04:11 PM",0.5994
2957,"yes, wa, elmina, gardens, active, join, ra",utellme,"Apr 19 2018, 05:14 PM",0.765
2958,"unit, construction, join, ra",kinseong,"Apr 19 2018, 08:25 PM",0.296
2959,"join, later",utellme,"Apr 19 2018, 08:28 PM",0.296
2960,"good, invite, ceremony",swn525,"Apr 19 2018, 08:48 PM",0.5423
2961,"elmina, gardens, owner, time, broadband, infra, enquire, sdp, infra?and, use, astro, iptv",kinseong,"Apr 19 2018, 10:27 PM",0.0
2962,"unifi, maxis, broadband",alextyw85,"Apr 19 2018, 11:14 PM",0.0
2963,"people, post, instagram, key",hiryuu,"Apr 20 2018, 09:55 AM",0.0
2964,"think, tm, unifi, maxis, time, mean, iptv, service, available, bad, tn50, vision, city, wonder, owner, raise, concern, sdp",kinseong,"Apr 20 2018, 10:05 AM",-0.3612
2965,"huh, mean, maxis, time, broadband, elmina, owner, 2, year, free, time, broadband, service, time, time, broadband, service, landed, property",tzuen,"Apr 20 2018, 10:07 AM",0.5106
2966,"know, introducer, fee, mean, sime, darby, website, package, offer, consider, buy",toji87,"Apr 20 2018, 10:14 AM",0.0
2967,"hopefully, @hiryuu, able, assist",tzuen,"Apr 20 2018, 10:23 AM",0.4019
2968,"lol, .., ask, referal, fee, ..., sa, knly, tell, this:5kfree, spafree, motand, rm, 10,000, rebate",hiryuu,"Apr 20 2018, 10:41 AM",0.4215
2969,"cny, promotion, yesterday, package, appeal, wedsite, write, referral, fee, rm, 38k, wonder, maybe, like, sp, setia, buyer, refer, sp, setia, previous, buyer, referral, fee",toji87,"Apr 20 2018, 11:14 AM",0.3612
2970,"idea, construction, opposite, ev, 1, 2, new, housing",alextyw85,"Apr 20 2018, 11:24 AM",0.0
2971,"commercial, area",SS25,"Apr 20 2018, 11:37 AM",0.0
