,sentences,users,date,sentiment_score
1715,"wow, run, fast, ya, know, sdp, effort, elmina, landscaping, not?because, compare, area, like, kota, kemuning, elmina, kalah, bit",Jasontee,"Aug 22 2017, 11:14 AM",0.743
1716,"complain, 2, sa, n, sdp, mgnt, lo, bro, new, md, ma, 😆, c, wthr, improvement, nt",BRE,"Aug 22 2017, 11:19 AM",0.128
1717,"kota, kemune, 10yrs, .., elmina, start, .., tree, small",lemina,"Aug 22 2017, 11:20 AM",0.0
1718,"ya, elmina, need, time, develop, landscape, area, kota, komune, near, new, project, impress, visit, week, house, elmina, course, hope, landscape, leng, leng, mah, haha, .., hope, management, sdp, message",Jasontee,"Aug 22 2017, 06:25 PM",0.8934
1719,"owner, corner, unit, elmina, valley, phase, 1, plan, let, .does, know, anybody, mayb, interested, buy, thankscontact, 0172111242",calcium206,"Aug 22 2017, 08:47 PM",0.4019
1720,"hi, long, time, lurker, study, try, learn, property, early, big, buck, start, buy, guy, think, write, up?https://www.theedgeproperty.com.my, content/, ..., eability, making",AOL24,"Aug 23 2017, 02:09 AM",0.0
1721,"wah, mr, apollo, photo, huge, like, celebrity",lemina,"Aug 23 2017, 08:39 AM",0.5859
1722,"buy, buy, buy, la, budget, wrong, 10, yearsthe, long, wait, small",easywin3,"Aug 23 2017, 08:56 AM",-0.4767
1723,"mrt, station, elmina, city, centre, establish, extension, sungai, buloh, mrt, station, sungai, buloh, kajang, mrt, line""confirm",swn525,"Aug 23 2017, 08:58 AM",0.0
1724,"keyword;when, demand",lemina,"Aug 23 2017, 10:33 AM",-0.128
1725,"interested, know, dash, open, article, state, early, 2020",New Klang,"Aug 23 2017, 11:57 AM",0.4019
1726,"elmina, greenhttp://www.simedarbyproperty.com/elminagreen1key, facts21, acre, waterfront, gardens5, acre, phase, communal, parks1.5, km, link, jogging, cycling, track, recreational, activity, activate, open, space, lane, lane, community, herb, fruit, tree, garden, security, grille, provide, unit, architectural, feature, additional, tier, security, building, design, tropical, energy, efficient, design, principle, ensure, thermal, comfort, maximize, natural, lighting, unit, open, plan, layout, optimize, space, functionality, specifically, design, multigenerational, living, lifetime, home, concept, cul, de, sacs, reduce, vehicular, traffic, safe, pedestrian, friendly, environment.20, x, 70, double, storey, link, home",elmond,"Aug 23 2017, 11:58 AM",0.9738
1727,"happy, dash, complete, early, 2020, reach, ikea, 1u, kl, 35, min",utellme,"Aug 23 2017, 12:04 PM",0.5859
1728,"umm, reach, 25, min, think, dash, reach, ~15, min, quick, question, list, sdp, panel, bank",lightonokira,"Aug 23 2017, 04:41 PM",0.0516
1729,"denai, alam, feature, page, 18",New Klang,"Aug 23 2017, 04:50 PM",0.0
1730,"prefer, denai, alamlast, 390, unit, land, come, plot, j1, h1j1, 228, unit, double, storey, link, 22x70, 22x75, rm700kh1, 162, unit24x80, double, storey, link, rm850k40x80, semi, d, rm1.6mil, rm1.7milplot, j1, ferreahttp://www.simedarbyproperty.com/ferrea",elmond,"Aug 23 2017, 04:54 PM",0.0
1731,"reach, page",elmond,"Aug 23 2017, 08:19 PM",0.0258
1732,"elmina, vs, setia, alam, superior, price, r, similar",PabloTH,"Aug 23 2017, 09:18 PM",0.5423
1733,"definitely, elmina, mrt, dash, come, location, nearer, pj, altitude, high, air, fresh, high, bumi, quota",New Klang,"Aug 25 2017, 12:44 AM",0.6124
1734,"want, pork, entertainment, ..., need, public, transportation, ...., setia, alam, lo, ...., setia, alam, greenery, anymore, ..., northen, setia, alam, ....",aaron1717,"Aug 25 2017, 09:10 AM",0.4767
1735,"choose, setia, alam, plan, sucess, township, althought, sa, connect, nkve, future, plan, link, dash, mrt.mrt, eastern, extension, sungai, buloh, pass, elmina, west, setia, alam, bukit, raja",alankong,"Aug 25 2017, 12:46 PM",0.0
1736,"u, type, c, right?mine, ev2, ..., kitchen, near, entrance, hahaha, ..., haiya",awie666,"Aug 27 2017, 05:51 PM",0.5574
1737,"15min, elmina, ikea, maybe, fast, driver, normally, 30min, 32, min, normal, traffic, 45min-60, min, bad, traffic, local, commercial, bank, sdp, panel, like, mbb, cimb, rnb, hlb, hsbc",utellme,"Aug 29 2017, 11:48 AM",-0.25
1738,"type, c, outlet, cooking, hood, yard, area, guess, window, plan, sd, website, look, like, window, kitchen, door, open, yard",8sg9ft,"Aug 29 2017, 02:00 PM",0.3612
1739,"stay, depend, work, regular, family, activity, investment, depend, budget, hold, power, like, ask, stay, kl, penang, think, requirement, expectation, come, kind, general, question",easywin3,"Sep 1 2017, 11:33 PM",0.7096
1740,"double, post, system, fault",easywin3,"Sep 1 2017, 11:46 PM",-0.4019
1741,"realize, kfc, open, e, boulevard",C&R,"Sep 2 2017, 03:52 PM",0.0
1742,"buy, unit, ev4, whatapps, group, join",Sw wong,"Sep 2 2017, 07:51 PM",0.296
1743,"location, villa, serirong, bangalow, lot, previously",utellme,"Sep 2 2017, 11:05 PM",0.0
1744,"location, villa, rongseri, bangalow, lot, previously",utellme,"Sep 2 2017, 11:06 PM",0.0
1745,"owner, whatsapp, fb, group, ev3",rummage,"Sep 3 2017, 10:43 AM",0.0
1746,"thank, dude, help, pls, post, ev2a.",zedscofield86,"Sep 6 2017, 02:30 PM",0.6705
1747,"pm, phone, number, add, elmina, valley, whatsapp, group",jiwabesar,"Sep 6 2017, 04:18 PM",0.0772
1748,"ya, keen, join, watsapp/, fb, group, chat, ev3, pls, kindly, pm",angeling79,"Sep 6 2017, 04:20 PM",0.802
1749,"bro, idea, d, price, n, build, wjen, launch",BRE,"Sep 6 2017, 04:39 PM",0.0
1750,"pm, number",Yogi89,"Sep 6 2017, 04:42 PM",0.0772
1751,"hi, come, vianna, superlink, time, temasya, glenmarie, superlink, anybody, familiar, area, think",eco2722,"Sep 6 2017, 06:47 PM",0.0
1752,"budget, allow, temasya, sinar, 2, design, sinar, 1, 28x110, build, 3600sqft, location, wise, sure, elmina",albhong,"Sep 6 2017, 06:50 PM",0.743
1753,"think, elmina, east, viana, leave, bumi, unit, non, bumi, unit",utellme,"Sep 6 2017, 06:53 PM",-0.0516
1754,"theory, temasya, glenmarie, suppose, bumi, leave, problem",elmond,"Sep 6 2017, 06:55 PM",-0.4404
1755,"thank, information, actually, bumi, bit, limited, guess",eco2722,"Sep 6 2017, 07:10 PM",0.1531
1756,"any1, know, j1, h1, area, idea, check",sleepingfrost,"Sep 6 2017, 11:15 PM",0.0
1757,https://forum.lowyat.net/index.php?showtopi...&#entry85702557https://forum.lowyat.net/index.php?act=atta...post&id=8978125,elmond,"Sep 6 2017, 11:54 PM",0.0
1758,"thanks, bro",sleepingfrost,"Sep 7 2017, 12:27 AM",0.4404
1759,"pm, number, thank",Sw wong,"Sep 7 2017, 07:03 AM",0.4215
1760,"add, i've, create, group, ev3, buyer, feel, free, pm, number",angeling79,"Sep 7 2017, 08:27 AM",0.6908
1761,"admin, ev4, whatapps, group, add",lancengchai84,"Sep 7 2017, 09:03 AM",0.0
1762,"hi, angeling79, pm",Jonker,"Sep 7 2017, 09:59 AM",0.0
1763,"got, stray, wild, dog, elmina, garden, look, like, infect, ..., kid, chase, today, ..., worried, ..., idea",lightonokira,"Sep 7 2017, 11:05 AM",0.0772
1764,"report, ra, u, ra, report, city, council, need, draft, letter",Nymphetamine666,"Sep 7 2017, 12:35 PM",0.0
1765,"owner, whatsapp, fb, group, ev4",lancengchai84,"Sep 7 2017, 03:20 PM",0.0
1766,"u, check, inbox, message",lancengchai84,"Sep 7 2017, 03:30 PM",0.0
1767,"quotedone, pls, check",lancengchai84,"Sep 7 2017, 03:51 PM",0.0772
1768,http://thestar.com.my/business/business-ne...ghway-contract/,cheesaen,"Sep 7 2017, 04:59 PM",0.0
1769,"ev3, buyer, here?it, worth, buy, ev3, 880k, shd, wait, launch, elmina, budget, 800k-900k, 24'x75, 4, bedroom",YY06,"Sep 7 2017, 05:03 PM",0.2263
1770,"like, ev3, courtyard, design, 24x75, floor, plan, type, think, wait, ev5, denai, alam, j1, launch, end, year",utellme,"Sep 7 2017, 08:04 PM",0.3612
1771,"denai, alam, j1, much?i, think, ev5, small",lightonokira,"Sep 8 2017, 12:08 AM",0.0
1772,"da, j1, 22x70, 22x75.i, know, floor, plan, layout, ev5, likely, ev4",utellme,"Sep 8 2017, 09:18 AM",0.0
1773,https://forum.lowyat.net/index.php?showtopi...post&p=85875856,elmond,"Sep 8 2017, 10:11 AM",0.0
1774,"like, ev3, courtyard, design, think, waste, space, courtyard, big, space, maybe, extra, room, hesitate, look, place, s, case, think, h1, cheap, big, hopefully, layout, disappoint",YY06,"Sep 8 2017, 10:14 AM",-0.34
1775,"realize, elmina, green, near, hillpark, eco, grandeur, bad, theirs, leasehold, think, sale, office, use, persiaran, mokhtar, dahari, road, far, gosh",YY06,"Sep 8 2017, 09:17 PM",-0.0258
1776,"price, green, slightly, low, guess, design, look, good",lemina,"Sep 8 2017, 09:23 PM",0.2716
1777,"design, price, shd, low, eg1, location, kinda, far, city, centre, west, respond, slow",YY06,"Sep 10 2017, 06:15 PM",-0.2732
1778,"yeah, think, ago, sale, gallery",lemina,"Sep 10 2017, 11:01 PM",0.296
1779,"map, h1, maybe, locate, gch, dusty, noisy, semid, unit, land, size, 40x80, small",utellme,"Sep 11 2017, 07:13 AM",-0.1779
1780,"know, ev3, courtyard, roof, covering, mean, rain, courtyard, wet, glass, covering",YY06,"Sep 11 2017, 08:21 AM",0.0
1781,"like, location, near, highway, drive, far, compare, j1, want, 24x80, layout, hopefully, simple, nice",YY06,"Sep 11 2017, 08:48 AM",0.8074
1782,"certainly, look, like, roof, covering",8sg9ft,"Sep 11 2017, 08:49 AM",0.5994
1783,"equivalent, current, bukit, subang, exitarea, go_gce, from_gcej1, 1.6, km, 1.6kmh1, 900, m, 1.8, km",elmond,"Sep 11 2017, 02:27 PM",0.0
1784,"know, ev3, 20x60, pricing",budak minyak,"Sep 11 2017, 02:28 PM",0.0
1785,"elmina, green, saujana, utama, 3.size, 20x70from, rm, 700k, onwards",zedscofield86,"Sep 11 2017, 02:36 PM",0.0
1786,"courtyard.if, cover, sun, lounge, moon, lounge",BEANCOUNTER,"Sep 11 2017, 02:58 PM",0.0
1787,"nt, cheap, 20x70, oredi, cost, 700k, mayb, gey, serenia, city, 20x70, cheap, 600k+",BRE,"Sep 11 2017, 05:06 PM",0.0
1788,"think, nice, place, low, light, plant, garden, pond, waterfall, like, feature",lemina,"Sep 11 2017, 05:12 PM",0.4939
1789,"ev1, 20x65, 590k, ev3, 20x60, possibly, 640k",easywin3,"Sep 11 2017, 05:40 PM",0.0
1790,"ev1, 20x60",lemina,"Sep 11 2017, 06:07 PM",0.0
1791,"size, increase, 50k, new, phase",zedscofield86,"Sep 11 2017, 06:17 PM",0.3182
1792,"stay, investment, assume, buyer, affordable, sacrifice, elmina, location, 100k, wise, choice, 20x60,20x70, developer, unit, leave, today",easywin3,"Sep 11 2017, 07:36 PM",0.4404
1793,"thank, correction",easywin3,"Sep 11 2017, 07:48 PM",0.3612
1794,"location, wise, serenia, city, nt, bad, near, klia, xiamen, u, n, putrajaya, n, direct, access, 2, elite, 100k, lot, money, n, big, diff",BRE,"Sep 11 2017, 09:27 PM",-0.1027
1795,"buy, new, launch, property, unoccupied, lead, major, glut, buy, subsale",New Klang,"Sep 12 2017, 12:30 AM",0.0
1796,"nowadays, luxury, high, rise, building, oversupply, landed, property, nearby, kl, pj, area",easywin3,"Sep 12 2017, 09:01 AM",0.0
1797,"s, left, interested, elmina",herman7,"Sep 12 2017, 09:05 AM",0.4019
1798,"elmina, valley, owner, consider, near, mrt, kl, mrt, rapid, bus, elmina, long, drive, nearet, mrt, look, kwasa, sentral, station",herman7,"Sep 12 2017, 08:27 PM",0.0
1799,"wait, persiaran, atmosphere, fully, connect, link, la, 2, 3, km, maybe, mrt, shuttle, bus, service",commtrader,"Sep 12 2017, 09:12 PM",0.0
1800,"come, sdp, office, notice, ev3, available, cheap, 880k, sell, think, couple, corner, unit, available, phase, sure, check, hope, help",Cyranodbg,"Sep 13 2017, 10:59 PM",0.7845
1801,"thanks, drop, elmina, gallery, weekend, 880k, intermediate, unit, s, land, size, recall, interest, end, lot, probably, sell",herman7,"Sep 14 2017, 12:09 AM",0.5859
1802,"near, mrt, feeder, bus, subang, suria, nowhttps://www.myrapid.com.my/traveling-with-u...r?routeid=t8020",elmond,"Sep 14 2017, 08:49 AM",0.0
1803,"purpose, air, air, ventilation, point, cover, w, glass, panel, p",angeling79,"Sep 14 2017, 10:13 PM",0.0
1804,"end, lot, corner, unit, available, facong, water, tank, nice, sd, plant, nice, pine, tree, cover, water, tank, indian, temple",angeling79,"Sep 15 2017, 08:50 AM",0.6808
1805,"mean, elmina, nearby, kl, pj",New Klang,"Sep 15 2017, 09:19 AM",0.0
1806,"nearby, subjective",easywin3,"Sep 15 2017, 09:49 AM",0.0
1807,"ev3, 20x60, price, 619,888, bumi, discount",acik_qdeen,"Sep 17 2017, 08:04 PM",0.0
1808,"thanks, bro, bumi, discount, 7",budak minyak,"Sep 17 2017, 08:16 PM",0.4404
1809,"yeap, 7, discount, bumi",acik_qdeen,"Sep 18 2017, 09:06 AM",0.0
1810,"great, affordable, price",easywin3,"Sep 18 2017, 09:59 AM",0.6249
1811,"24x75, intermediate, lot, 880k, ask, price, end, lot, feel, price, imo",Cyranodbg,"Sep 18 2017, 01:00 PM",0.0
1812,"agree, think, corner, end, lot, elmina, project, overprice, easily, double, price, intermediate, corner, lot, jz, buy, 2, intermediate, merge, lol",budak minyak,"Sep 18 2017, 01:32 PM",0.7717
1813,"wonder, mosque, noise, klinik, kesihatan, hear, ev3",rummage,"Sep 20 2017, 02:59 PM",0.0
1814,"use, word, noise",simplest,"Sep 20 2017, 10:14 PM",0.0
1815,"currently, mosque, bukit, subang, denai, alam.can, point, map",elmond,"Sep 21 2017, 12:44 AM",0.0
1816,"derogatory, term, describe, sound, religious, ritual",herman7,"Sep 21 2017, 08:28 AM",0.0
1817,"mean, sound",rummage,"Sep 21 2017, 10:27 AM",0.0
1818,"currently, mosque, plot, reserve, mosque, question, hear, ev3, yes, course, hear, barely, 150, m, away, near, ev3, unit, moot, point, mosque",8sg9ft,"Sep 21 2017, 01:28 PM",0.4019
1819,moment,xyber9,"Sep 21 2017, 01:37 PM",0.0
1820,"surprised, raise, issue, upcoming, klinik, kesihatan, .., big, storey, near, surely, affect",brother love,"Sep 21 2017, 03:39 PM",0.5859
1821,"mbsa, aduan, website, http://aduan.mbsa.gov.my, choose, kawasan, sungai, bulohsection, u16jenis, aduan, anje",xyber9,"Sep 21 2017, 03:52 PM",0.0
1822,"hi, purchase, unit, ev4, whatsapp, group, owner, add",Kayulog,"Sep 21 2017, 04:24 PM",0.0
1823,"wahlau, elmina, unit, psf",TSjeghui,"Sep 24 2017, 10:14 AM",0.0
1824,"u, mathrm880k, 2,626sq, ft",angeling79,"Sep 25 2017, 03:10 PM",0.0
1825,"purchase, unit, ev4, add",Dive2Blue,"Sep 25 2017, 04:15 PM",0.0
1826,"price, setia, alam, developer, unit, like, elmina, design",lightonokira,"Sep 25 2017, 04:28 PM",0.3612
1827,"target, price, 2333sqft, unit, consider, rm850k, unit, translate, rm364psf",TSjeghui,"Sep 26 2017, 12:51 PM",0.0
1828,"unit, ev1",Sand Dust,"Sep 26 2017, 01:07 PM",0.0
1829,"key, unit, management, official, whatsapp, group, live, garinia, elmina, east, add, whatsapp, group, like, talk, drawing, house, begin, reno, work, elmina, management, ask, architect, engineer, ask, drawing, developer, forth, nonsense, haha",xxept0,"Sep 26 2017, 01:14 PM",0.4215
1830,"subsale, unit, contact, cs, management, sure, ra, contact, number",utellme,"Sep 26 2017, 01:56 PM",0.3818
1831,"house, owner, elmina, 2, property, construction, maybank, charge, fire, insurance, house, owner",Nanonature,"Sep 26 2017, 02:41 PM",-0.34
1832,"fire, insurance",s-one,"Sep 26 2017, 11:44 PM",-0.34
1833,plus,Nanonature,"Sep 27 2017, 10:47 AM",0.0
1834,"request, copy, fire, insurance, certificate, developer, send, bank, request, refund, developer, purchase, fire, insurance, require, purchase, insurance",albhong,"Sep 27 2017, 11:04 AM",-0.5859
1835,"know, progress, elmina, garden, fencing, guard, plan, hearsay, free, security, guard, complete, 2, yrs, soon, sd, remove",Sand Dust,"Sep 27 2017, 11:13 AM",0.8176
1836,"cimb, bank, pay, monthly, interest, fire, insurance, charge",easywin3,"Sep 27 2017, 11:28 AM",0.0516
1837,"thank, lot",Nanonature,"Sep 27 2017, 11:34 AM",0.3612
1838,"wonder, elmina, valley, 3, stage, 1, stage, 2, diff, 13k, design, area, 13k",YY06,"Sep 27 2017, 11:35 AM",0.0
1839,"hearsay, elmina, green, 20×70, price, 700k+, nt, cheap, leh",BRE,"Sep 27 2017, 11:53 AM",0.0
1840,buyer,New Klang,"Sep 27 2017, 11:59 AM",0.0
1841,,jiwabesar,"Sep 27 2017, 12:54 PM",0.0
1842,"away, temple, save, interest",jiwabesar,"Sep 27 2017, 12:59 PM",0.7351
1843,"wow, wait, november, 2018, ...",Farhan Matic,"Sep 27 2017, 05:28 PM",0.5859
1844,"wow, wait, november, 2018, ...",Farhan Matic,"Sep 27 2017, 08:03 PM",0.5859
1845,"nt, launch, mayb, tbeir, serenia, city, b, cheap",BRE,"Sep 27 2017, 08:55 PM",0.0
1846,"hear, seller, sde, ev5, high, end, phase, location, close, tasik, forest, reserve",Farhan Matic,"Sep 28 2017, 06:24 AM",0.0
1847,"premium, points?very, ambitious, price, small, unit, target, market",New Klang,"Sep 28 2017, 06:29 AM",0.4767
1848,"big, park, 1, include, future, propose, mrt, stn, 700+k, b, targette, 1st, time, homebuyer, mayb, upgrader, 20x70, bit, small, b, exceed, 2000sft",BRE,"Sep 28 2017, 08:56 AM",0.0
1849,"elmina, valley, owner, check, mail, -10am, 1, p.m., 9th, sept, 2017elmina, resident, engagement, elmina, city, pavilionfor, residents, association, formation",easywin3,"Sep 30 2017, 07:23 AM",0.4588
1850,"know, talk, elmina, gallery?saw, newspaper, forget, timing, ...",Kelvin123@,"Sep 30 2017, 09:27 AM",-0.2263
1851,http://www.starproperty.my/index.php/surve...rby-forum-2017/there,Sand Dust,"Sep 30 2017, 12:28 PM",0.0
1852,"upgrader, consider, small, unit, price?price, future, mrt, station, factor, in?big, park, use, public, park",New Klang,"Sep 30 2017, 04:58 PM",0.0
1853,"d, condo, wth, private, park, thnk, maple, nt, 2, enjoy, public, park, park, challenge, 2, upgrader, 2, buy, price, n, guess, new, township, launch, phase, d, subsequent, launch, nvr, b, cheap, mrt, stn, elmina, nt, confirm, altho, sdp, b, push, 4, manage, 2, d, lrt, hub, ph, d, mrt, stn, elmina",BRE,"Sep 30 2017, 09:01 PM",0.0258
1854,"mrt, convenient, klang, valley, value, adder, mrt, great, predict, plenty, rebate, discount, come",New Klang,"Sep 30 2017, 11:45 PM",0.7579
1855,"mrt, elmina, year, road, 15, 20, year, mrt, 3, line, confirm, complete, 10, year, time",8sg9ft,"Sep 30 2017, 11:56 PM",0.0
1856,"s, mrt, u, option, nt, absolute, factor, choose, property, ...., eventually, msian, mainly, travel, alot, drive, public, transport, ..., jam, chera, peak, hour, great, proof, ..., mention, location, lrt, line, ...., traffic, jam, happen, time, area, ....",aaron1717,"Oct 1 2017, 12:02 AM",0.6249
1857,"mrt, good, alternative, transport, mode, d, event, yr, car, break, u, want, 2, avoid, jam",BRE,"Oct 1 2017, 10:07 AM",0.25
1858,"sime, darby, problem, effort, build, mall, hope, sell, land, people, interested, open, mall",TSjeghui,"Oct 1 2017, 10:08 AM",0.4404
1859,"theu, build, mall, mature, location, nt, township, ...., like, melawati, mall, mall, mrr2, kepong, direction, ..., haha",aaron1717,"Oct 1 2017, 07:19 PM",0.8074
1860,"believe, phase, mrt, line, depend, cash, injection, somebody, prasarana, account, .prasarana, cash, enhance, mrt, facility, include, enhance, shuttle, bus, system, prasarana, totally, rely, gov, inject, money, wait, gov, budget, pray, pm, najib, hahahaha",Farhan Matic,"Oct 1 2017, 07:49 PM",0.3182
1861,"melawati, sdp, township, ma, mall, sdp, build, mrt2, kepong, direction",BRE,"Oct 1 2017, 08:40 PM",0.0
1862,"forget, ..., like, huge, mall, ..., klfa, football, field, ...., melawati, mall, ..., haha",aaron1717,"Oct 1 2017, 09:11 PM",0.7096
1863,"launch, elmina, green, saujana, utama",TSjeghui,"Oct 1 2017, 10:24 PM",0.0
1864,"far, furth, ...",Sand Dust,"Oct 1 2017, 10:39 PM",0.0
1865,"maintain, big, park, lake, elmina, green",New Klang,"Oct 2 2017, 10:20 AM",0.0
1866,"shud, b, mbsa, eg, individual, title",BRE,"Oct 2 2017, 11:19 AM",0.0
1867,"close, commercial, activity, bsu, ..., basic, easily, ....",aaron1717,"Oct 2 2017, 11:26 AM",0.34
1868,"need, booking",Don don,"Oct 2 2017, 11:31 AM",0.0
1869,"e, mail, rsvp, limit, 4, pax, unit",Jonker,"Oct 2 2017, 11:32 AM",0.0
1870,"overwhelming, response, rsvp, closed",anulus81,"Oct 2 2017, 01:57 PM",0.0
1871,"update, elmina, valley, phase, 3.anyone, picture, internal, curious, kicthen, look, like",cksafety,"Oct 2 2017, 02:06 PM",0.5859
1872,"sorry, vacation, meeting",easywin3,"Oct 2 2017, 04:20 PM",-0.0772
1873,"parent, elmina, talk, week, pet, park, picture, incomplete, dash, highway, 10, min, curve",taiping...,"Oct 4 2017, 09:39 AM",0.0
1874,"key, takeaways:1, dash, highway, confirm, evidence, aerial, view, capture, drone2, time, broadband, 300mbps, 2, yrs, free, attach, house, 6, month, grace, period, activation, 2yrs, therafter, rm1893, park, forest, park, cultural, park, urban, park, community, park, sport, park4, insulate, roof, use, mineral, wool, effective, way, minimise, heat, loss, reduce, heating, bills.5, city, elmina, q1000, flood, free, access, 1, 1000, year, flood, event, min, require, q100.6, progress, video, phase, tnb, substation, design, it.7, mention, ra, phase, security, guard, gated.8, mrt, station, capture, local, state, development9, sime, request, dash, interchange, elmina, prolintasoverall, m, happy, overall, presentation, update",anulus81,"Oct 4 2017, 11:34 AM",0.959
1875,"thank, great, update",Sand Dust,"Oct 4 2017, 11:48 AM",0.765
1876,"lol., break, curve, driving, record",Sand Dust,"Oct 4 2017, 11:55 AM",0.0
1877,"expect, vp, 2018, wait",lightonokira,"Oct 4 2017, 01:50 PM",0.0
1878,"yeah, plus, forget, gate, guard, house, impressed, progress, edit, crowd, diverse",lightonokira,"Oct 6 2017, 11:49 AM",0.7351
1879,"event, way, obtain, presentation, slide, video, know, sound, impossible",demarco,"Oct 6 2017, 12:00 PM",0.0
1880,"hi, ev1, buyer, event, saturday, excited, town, plan, free, internet, mention, iirc, pleasant, surprise, .glad, dash, highway, confirm, buyer, stay, appreciate, sd, effort, central, park, way, aerial, view, sdp, app, update, august, image, community, garden, tnb, substation, presentation",fadzlie,"Oct 6 2017, 12:02 PM",0.9153
1881,"yup, attande, awesome, .., hope, township, win, bukit, jelutong, ..",Farhan Matic,"Oct 6 2017, 12:05 PM",0.8957
1882,"lunch, event, know, revisit, fun, seller, confirm, time.com, agree, 300mbps, superb, ...",Farhan Matic,"Oct 6 2017, 12:08 PM",0.872
1883,"ev2a, buyer, here'2, time, broadband, 300mbps, 2, yrs, free, attach, house, 6, month, grace, period, activation, 2yrs, therafter, rm189'is, real, tapau, unifi, kaw, kaw, la, like",awie666,"Oct 6 2017, 12:19 PM",0.8225
1884,"time, broadband, usually, provide, service, high, end, condo, kv, sdp, manage, convince, provide, service, ev, great!and, dash, happen, add, point, ev, miss, nearby, basic, amenity, shopping, mall, maybe",Jonker,"Oct 6 2017, 12:31 PM",0.1759
1885,"try, ask, email, thread",lightonokira,"Oct 6 2017, 12:37 PM",0.0
1886,"haha, elmina, gardens, jealous, .., tm",lemina,"Oct 6 2017, 12:37 PM",0.0
1887,"thank, info",easywin3,"Oct 6 2017, 12:41 PM",0.3612
1888,"wait, mrt, station, kvmrt, plan",TSjeghui,"Oct 6 2017, 12:43 PM",0.0
1889,"know, whatsapp, chat, group, ev3, like, join, appreciate, admin, whatspp, ev3, pm, thank",SkyActiv,"Oct 6 2017, 01:34 PM",0.836
1890,"selangor, transport, master, plan, federal, initiative",elmond,"Oct 6 2017, 03:11 PM",0.0
1891,"free, time, broadband, apply, new, unit, exist, elmina, garden, owner",swn525,"Oct 6 2017, 03:16 PM",0.5106
1892,"know, time, manage, contract, elmina, west, area, eg, tm, .., change",lemina,"Oct 6 2017, 05:17 PM",0.0
1893,"cool, selangor, transport, master, plan",TSjeghui,"Oct 6 2017, 06:21 PM",0.3182
1894,"haha, ya, exciting, update!few, pic, capture",angeling79,"Oct 6 2017, 06:27 PM",0.7574
1895,"mrt, project, prasarana, project, owner, mrt, corp, prasarana, sub, rapid, rail, operate, mrt, sbk, .but, rely, govt, money, spot",zerol410,"Oct 6 2017, 06:30 PM",0.0
1896,"nice, pic, thank, chance, key, 1, 2, month, early, expect",easywin3,"Oct 6 2017, 06:39 PM",0.743
1897,"look, like, easy, 2, climb, in2, d, yard, area, shud, high, grille, door, lane, look, nice, n, neat, altho, greens, like, d, 1, em",BRE,"Oct 6 2017, 06:48 PM",0.9136
1898,"red, brick, removable, accord, sdp, soil, underneath, plant, herb",lightonokira,"Oct 6 2017, 07:18 PM",0.0
1899,"sdp, shud, plant, shrub, 2, standardize, d, green, instead, allow, owner, 2, plant, d, backlane, look, chaplang, n, untidy",BRE,"Oct 6 2017, 10:49 PM",0.2263
1900,"http://dewan.selangor.gov.my/assets/pdf/se...lan%20mulut.pdfrefer, page, 30, elmina, cover, mrt, sungai, buloh, extensionthere, plan, lrt, rawang, shah, alam, putrayaja, township, puncak, alam, selangor, vision, city, bukit, subang, bukit, jelutong, kota, kemuing, bandar, rimbayuhave, wait, long, long, lah, :-)",willyboy88,"Oct 7 2017, 09:09 AM",0.5106
1901,"backlane, similar, ev?im, ev2, ..",awie666,"Oct 7 2017, 01:08 PM",0.0
1902,"yesterday, starproperty, forum, external, township, expert, actually, mention, expect, commercial, vibrancy, township, 10, year, later, good",Sand Dust,"Oct 9 2017, 11:34 AM",0.4404
1903,"expect, piggyback, township",lightonokira,"Oct 9 2017, 11:43 AM",0.0
1904,"ev1, buyer, like, ra, whatsapp, group, need, assistance, add, number, know, contact?thanks",sid310857,"Oct 9 2017, 02:04 PM",0.4215
1905,"want, join, elmina, valley, whatsapp, group, pm, number",jiwabesar,"Oct 9 2017, 02:10 PM",0.4215
1906,"puy, ev, whatapp, group",SkyActiv,"Oct 9 2017, 02:35 PM",0.0
1907,"reference, regard, rabetter, contact, pic, directly, instead, ask, ev4, want, volunteer, urself, pic, ev4, contact, sdp, directly",redalert,"Oct 9 2017, 03:59 PM",0.0772
1908,"pm, ur, number",angeling79,"Oct 9 2017, 04:22 PM",0.0772
1909,"invite, ev3, ra, communication, channel",lightonokira,"Oct 9 2017, 04:22 PM",0.1531
1910,"pls, pm, ur, number",angeling79,"Oct 9 2017, 04:30 PM",0.1531
1911,"sale, slow, corner, unit, sell, intermediate, unit, available",angeling79,"Oct 10 2017, 10:38 AM",0.0
1912,"phase, n, wat, d, price, n, size, pls, elmina, expensive, nt, surprised, sale, slow, corner, unit, r, available",BRE,"Oct 10 2017, 11:56 AM",0.296
1913,"think, update, sale, chart",rummage,"Oct 10 2017, 12:05 PM",0.0
1914,"ev3, ..., ev1, ev2, ev3, ev4, prove, hot, sale, ..., ev3, people, follow, development, mainly, individual, opinion, wrt, religious, sure, hot, like, ev1, ev2, ev3, ev4",redalert,"Oct 10 2017, 01:51 PM",0.5859
1915,"mosque, temple, nearby, thts, y, sale, slow",BRE,"Oct 10 2017, 02:09 PM",0.0
1916,"...., reason, ..., elmina, good, township, stay, investment",redalert,"Oct 10 2017, 03:03 PM",0.4404
