,thread_name,username,post_content,posted_at
182,THE CLIO RESIDENCE @ IOI RESORT CITY ,vinctan88,"Indicative price at RM600/sf. Available sizes of 872, 1,012, 1,151 & 1,410 sf. For own stay, bigger sizes will be more suitable ie 1,151 sf. will be around RM700k +/- depend on the floor level too.You can send in your enquiries to property.marketingirc@ioigroup.com or via their FB page - IOI Properties Berhad. They will send you the detailed plans.","May 22 2014, 03:47 PM"
183,THE CLIO RESIDENCE @ IOI RESORT CITY ,jepakazoid_82,Thanks bro for the info. Just wondering RM 600 psf is before or after discount?,"May 22 2014, 03:50 PM"
184,THE CLIO RESIDENCE @ IOI RESORT CITY ,CharmaineLee80,872sf * RM600/sf => ~RM523200.any discount? and easy payment is 0% installment for the down-payment?,"May 22 2014, 03:51 PM"
185,THE CLIO RESIDENCE @ IOI RESORT CITY ,leelee1988,Got this news letter from ioi.Puteri palma penthouse for sale only rm 452 persquare feet promotion discount 3% valid till end of this months.Anyone interestedwe can share the referer fee..http://sendgrid.com/wf/webmail?rp=ZTI1bGQz...URReE5qUTROVEo5,"May 22 2014, 03:53 PM"
186,THE CLIO RESIDENCE @ IOI RESORT CITY ,MNet,1.1mil so exp with these kind of design,"May 22 2014, 08:41 PM"
187,THE CLIO RESIDENCE @ IOI RESORT CITY ,Nidz,"location, location, location is normally use for investment decisions. for own stay, anywhere is a good place to stay, according to their own needs.i personally prefer this project because it is nearby to my workplace, my parents house as well as very near to the shopping mall. I am a cinema kaki, so this is a very good advantage as well.","May 22 2014, 09:01 PM"
188,THE CLIO RESIDENCE @ IOI RESORT CITY ,Stephanie_x,Hello.. may I know how is this easy payment of the 10% works ?,"May 22 2014, 09:37 PM"
189,THE CLIO RESIDENCE @ IOI RESORT CITY ,Stephanie_x,"Hmm.... Nidz, what's your opinion of this clips location, location and location ?? Will it be a wise choice for investment ?","May 23 2014, 11:20 AM"
190,THE CLIO RESIDENCE @ IOI RESORT CITY ,vinctan88,"That should be the indicative price for the mid-floors unit, subject to the build up area too. Generally, bigger the built up area, lower the psf $.The promotion / payment package not finalized yet. Normally will inform when closer to the launch say few days or 1 week before?If refer to IOI existing project, this easy payment scheme allows you to deferred your down payment ie 10% / differential sum up to 18 months instead of paying full 10% upon signing SPA. But if IOI will adopt the same scheme for The Clio is still unknownI will say buy for its township development. The IOI City Mall, Offices, Hotel, High-end bungalows and retail outlets, township with golf course etc. And in terms of south klang valley, this is somewhere the center point between Kajang, Bangi, Sepang, Puchong South, Serdang / Seri Kembangan, Dengkil, Cyberjaya and Putrajaya.","May 24 2014, 03:02 AM"
191,THE CLIO RESIDENCE @ IOI RESORT CITY ,jepakazoid_82,I didnt use this strategy when Im buying the property im currently staying in. Now I regretted this decision. No public transport. No good hospital. No night life. Ive learned my lesson the hard way.,"May 24 2014, 07:04 AM"
192,THE CLIO RESIDENCE @ IOI RESORT CITY ,Stephanie_x,do u mind to share where is the location?,"May 24 2014, 08:49 AM"
193,THE CLIO RESIDENCE @ IOI RESORT CITY ,Stephanie_x,"thanks @vintan88..wish there will be rebates, freebies","May 24 2014, 12:39 PM"
194,THE CLIO RESIDENCE @ IOI RESORT CITY ,jepakazoid_82,I can tell you the location over a cup of coffee perhaps?,"May 24 2014, 12:41 PM"
195,THE CLIO RESIDENCE @ IOI RESORT CITY ,Nidz,"Since I am planning to buy this project for own stay, I do not know whether it will be a wise decision for investment.But, from my observation, let's say that I decided to stay in another place when this project is finally finished. I don't think that I will have trouble in selling this unit or renting it out. My points are:1) By the time this project is completed, the shopping mall will already be in full swing. Seeing the current trends in property near shopping malls which I am familiar with, (Empire Subang, Setiawalk Puchong), this project is better located and the mall is really huge!! Biggest GSC cinema, bowling alleys, ice skating rink... and aside from the office towers, they are already planning the second phase of the mall. The total mall size will be 2.2 million sqft net lettable area. As a comparison, Mid Valley is 1.7 mil and Pavillion is 1.4 mil (Same size of the first phase of IOI City Mall).2) This project is the newest residential project in that township. The existing Puteri Palma was already sold out (except for their penthouse) and currently fetching a good rental rate at rm2k - rm3k. The buyer of this project will have the advantage of first mover in this township. Provided that all things stay the same and the property bubble doesn't burst, the developer will almost always increase the selling price of the next phase development in that township. So, I can say that these first mover will have the cost advantage of their units.3) Traffic wise, I don't think it would become a major problem even if the mall is in full swing. The reason being, IOI will be planning their traffic route in this township very carefully. I say this because this area is their HQ, and Tan Sri also lives there, in the Diamond Hill.This is my current analysis for choosing this project for my own stay. Investment wise, I really don't know how it will be in the future, but currently the signs are good. But of course, further analysis is needed.Just my 2 cents","May 24 2014, 12:46 PM"
196,THE CLIO RESIDENCE @ IOI RESORT CITY ,TSaccetera,Malaysia's only Olympic-sized ice skating rink will be located in IOI City Mall.,"May 24 2014, 01:33 PM"
197,THE CLIO RESIDENCE @ IOI RESORT CITY ,CMW123,The one in sunway pyramid is how many % equivalent of a Olympic sized one?,"May 24 2014, 02:53 PM"
198,THE CLIO RESIDENCE @ IOI RESORT CITY ,vinctan88,Sunway Pyramid Ice Skating RinkOlympic Size Ice Skating RinkYour imagination,"May 24 2014, 05:53 PM"
199,THE CLIO RESIDENCE @ IOI RESORT CITY ,enkil,Haha.. maybe Pyramid slightly smaller,"May 24 2014, 06:28 PM"
200,THE CLIO RESIDENCE @ IOI RESORT CITY ,nkhong,"Hi taiko, since u work near this place,Any idea who is target tenants if wanna rent out? Or any idea who are puteri palma current tenants? Easily rent out?","May 24 2014, 07:35 PM"
201,THE CLIO RESIDENCE @ IOI RESORT CITY ,CMW123,"Last I visited, puteri Palma seems have many vacant units n the carpark also has many vacant baysThere are some Koreans staying there tooThe new mall should bring in more peopleIOI advertised in the Star yesterday to sell their unsold penthouse","May 24 2014, 07:48 PM"
202,THE CLIO RESIDENCE @ IOI RESORT CITY ,puchongite,The vacant units are unsold or sold ?,"May 24 2014, 10:14 PM"
203,THE CLIO RESIDENCE @ IOI RESORT CITY ,CMW123,Sold,"May 24 2014, 10:29 PM"
204,THE CLIO RESIDENCE @ IOI RESORT CITY ,jepakazoid_82,How much is the rental rate there?,"May 24 2014, 11:50 PM"
205,THE CLIO RESIDENCE @ IOI RESORT CITY ,CMW123,"Hardly find any listing even in iproperty, seems like the sub sale transactions are pretty inactive","May 30 2014, 03:08 PM"
206,THE CLIO RESIDENCE @ IOI RESORT CITY ,CaptainCool,"I have to disagree with that.i was looking for 1 around 1 year ago,the price was around 530k for 1200 sqft if I not mistaken. That was for the oldest phase. Seems like the rental there is good that it can cover installments that's why no 1 willing to let go now,while waiting for further appreciation because of the mall.","May 30 2014, 03:51 PM"
207,THE CLIO RESIDENCE @ IOI RESORT CITY ,CMW123,"Nobody is selling not mean inactive sub sale meh....At this price and being a decent family size unit, to fetch RM2xxx rental to cover installment is reasonable but did u notice that the whole place is very quiet n many vacant units even for the older phase...so it's good rental yield for units that were able to rent out but there are also many units that could not get tenants as unlikely there are so many owner are not bothered to rent outBelieved that the price should have gone up higher now in view of the mall opening especially this is a very low density project surrounded by a golf course","May 30 2014, 03:54 PM"
208,THE CLIO RESIDENCE @ IOI RESORT CITY ,Nidz,"Honestly, I have no idea who are the target tenants. Since I am buying this for my own stay, I did not consider that factor in my decision.I also don't think this property will attract a lot of tenant now. But once this township is mature, say maybe 5-10 years from now, that will be different situation altogether.","May 30 2014, 09:15 PM"
209,THE CLIO RESIDENCE @ IOI RESORT CITY ,nkhong,"Buy for ownstay easier, within affordable budget, like the location and property just buybuybuy. Buy for investment if cannot rent out in 1 year installment plus maintenance fee very siong.","May 31 2014, 02:02 AM"
210,THE CLIO RESIDENCE @ IOI RESORT CITY ,CaptainCool,"Last time when I wanted to buy there agent told me rental can target universities and hospitals nearby woh. How true is that no one knows,and in the end I also didn't buy.a bit regret actually.hahaha","May 31 2014, 11:51 AM"
211,THE CLIO RESIDENCE @ IOI RESORT CITY ,rachel_xxx,finally found an agent who tells the truth...,"May 31 2014, 12:00 PM"
212,THE CLIO RESIDENCE @ IOI RESORT CITY ,leelee1988,"I own a unit there already rented out for 3 years.. so far dont have any problem looking for tenant..1st year rented to lim kok weng middle east, rm 3300monthly2nd kind of desperate rent it out to african rm2800 pay one year advance3th indian expactrade working in cyberjaya rm 3000 monthlyTarget here mainly expactrade, mostly from cyberjaya and uni student from limkokweng..if u desperate africant will be ur last resort....can rent out anytime..In mine opinion main reason that many empty unit there is all owner all kaya kaya dato and datin. All waiting for the mall ready the sell off.. they dont intend to rent it out anyway or choosy on tenant I dont know..haha2nd is the owners there dont like rent to student and middle eastern people.3th the owners looking for rental like rm 5k or 6k. By saying how much money they put into the id and renovations. In reality how many people can affort that rental. If for investment purpose dont have to renovate untill so luxury..For expactrade in cyberjaya thier company only give rm 3k for them for house rental anything above 3k rental be very hard to look for tenant.Above just mine opinion, I maybe can be wrong..chill...haha","Jun 1 2014, 12:50 AM"
213,THE CLIO RESIDENCE @ IOI RESORT CITY ,CMW123,"Thanks for the good info, rental looks attractive, how much furnishing u provide?","Jun 1 2014, 11:17 AM"
214,THE CLIO RESIDENCE @ IOI RESORT CITY ,leelee1988,Im consider lucky.. just do basic fan and light furnishing only basiclly empty unit when rented out..all the furnishing inside is left by the middle eastern students. Rented out empty but when they move out become fully furnish mine unit..haha,"Jun 1 2014, 10:02 PM"
215,THE CLIO RESIDENCE @ IOI RESORT CITY ,vinctan88,"Puteri Palma Condo owners are mostly those buying for own stay / retirement and currently, the mall and commercial area are not ready yet; massive construction on going, this might be one of the reason why the occupancy rate is lower. Since is for own stay, some would just left their units vacant and not take the hassle to rent and manage the tenants. Some will just keep it as vacation use, kinda like weekend getaway from KL city? Another reason is, the phase 3 units were built then sell, if you say 2 years ago numbers of the units are not sold / completed transaction / renovation until end of last year / early this year, the vacancy obviously has increased.The owners are good mixed of locals, more towards chinese and retired expatriate from korea, japan, vietnam, china, singapore and western country etc.Rental wise, the target market are the expats working in Cyberjaya MNCs ie Dell, AT&T, Shell, HP; Pilot & Stewardess from Air Asia, MAS, Korean Airlines, Lecturers from the international schools ie Alice Smith, Nexus, John Hopkins and also the overseas students came here for study in the international schools, together with the guardian / parents. Also, the employees around serdang, sepang and bangi industrial area.The rental rate for say 1,400 sq. ft. units can fetch around RM2,300-RM2,500 for a basic furnished unit with light fittings, fans, air con, kitchen cabinet, curtains and wardrobe. The units initially already comes with the air con, kitchen cabinets, water heater and shower screens. Whereas for a fully furnished units, the rental is around RM2,800-RM3,300 depend on type of furnishing provides. For bigger unit, may rent up to RM4,000 and units with interior design asking around RM5000-6000/month. Average return we are looking at around 4% for basic furnished and 6% for fully furnished units. (the rates are not applicable if you are buying from the subsale market now ) Subsales current transacted price at around RM550-600/sf. However, the demand >>> supply since there is still huge potential for appreciation and a lot owners are not willing to sell. Some unit sold recently mostly the few expat here previously for business purposes is now moving out from Malaysia.The same rental you may expect for The Clio residences and most likely the units will also furnished with air cons, kitchen cabinets, water heater and maybe shower screens too. If that's the case, your furnishing cost to prepare the units for rent will be very minimum. around RM10k for basic furnished units with built-in wardrobe.","Jun 3 2014, 09:55 PM"
216,THE CLIO RESIDENCE @ IOI RESORT CITY ,Stephanie_x,"Vinct88, how many car parks would be provided for clio residence?","Jun 6 2014, 02:09 AM"
217,THE CLIO RESIDENCE @ IOI RESORT CITY ,Nidz,"Based on the SA explaination, each unit comes with 2 car park.","Jun 22 2014, 05:17 PM"
218,THE CLIO RESIDENCE @ IOI RESORT CITY ,Stephanie_x,"Thanks NidzSo.. we would expect 2 car parks, free air conditionals , free kitchen cabinet, free water heater, free shower screen ? 😆","Jun 22 2014, 06:08 PM"
219,THE CLIO RESIDENCE @ IOI RESORT CITY ,happyice,"remember someone mentioned that they will build a bridge link to ioi city mall? anyone can confirm? i checked, it's opposite the highway, so it's basically not 'walkable ' to the mall...","Jun 22 2014, 06:14 PM"
220,THE CLIO RESIDENCE @ IOI RESORT CITY ,Nidz,"Yes, they are building it as we speak. But it is not a pedestrian bridge, since the walking distance is quite far. I think the mall is 1-2km from this condo.From IOI City Mall, there is a flyover across the Putrajaya main road connecting to this condo. This flyover will be completed by the time the mall is open, or even sooner.","Jul 21 2014, 01:35 PM"
221,THE CLIO RESIDENCE @ IOI RESORT CITY ,vinctan88,View from Puteri Palma Condo,"Jul 21 2014, 01:46 PM"
222,THE CLIO RESIDENCE @ IOI RESORT CITY ,vinctan88,Panorama shot,"Jul 21 2014, 01:59 PM"
223,THE CLIO RESIDENCE @ IOI RESORT CITY ,TSaccetera,Awesome shot!,"Jul 21 2014, 02:02 PM"
224,THE CLIO RESIDENCE @ IOI RESORT CITY ,optimus28,how much is the price per sft for this?,"Jul 21 2014, 02:22 PM"
225,THE CLIO RESIDENCE @ IOI RESORT CITY ,Nidz,indicative price is at around rm600 psf. have to wait till launching to get the exact pricing.,"Jul 21 2014, 02:29 PM"
226,THE CLIO RESIDENCE @ IOI RESORT CITY ,optimus28,that's expensive...,"Jul 21 2014, 02:36 PM"
227,THE CLIO RESIDENCE @ IOI RESORT CITY ,mes23,"Living in resort bro. But not sure what address they will use it. If they use similar as their HQ, it look great...IOI Resort City, 62502 Putrajaya. Now...Cyberjaya service apartment also selling at RM650 psf.","Jul 21 2014, 02:39 PM"
228,THE CLIO RESIDENCE @ IOI RESORT CITY ,Stephanie_x,any update on the launching date yet?,"Jul 21 2014, 05:36 PM"
229,THE CLIO RESIDENCE @ IOI RESORT CITY ,CMW123,Aug 2014,"Jul 21 2014, 10:31 PM"
230,THE CLIO RESIDENCE @ IOI RESORT CITY ,enkil,Wow. pricey indeed,"Jul 22 2014, 06:01 PM"
231,THE CLIO RESIDENCE @ IOI RESORT CITY ,Nidz,"Finally, they are gonna launch this project next week, on 2nd August.VIP Bookings for those who bought the vouchers will be on 31st July.Price starts from 550k upwards, roughly rm600 psf.","Jul 22 2014, 06:47 PM"
232,THE CLIO RESIDENCE @ IOI RESORT CITY ,Babizz,"what's the market sentiment?? BBB??Biggest mall in Putrajaya area!btw, anyone has the list of tenants in the shopping mall?Hopefully, not the same boring F&B tenants!","Jul 30 2014, 05:03 PM"
233,THE CLIO RESIDENCE @ IOI RESORT CITY ,swisspalm,"Tesco HypermarketThailand’s Home-improvement brand, HomeProAEON Index Living Mall -will be opening its first location (something like ikea)ParksonGolden Screen Cinemas (GSC)StarWorld HotelOlympic ice skating rink70,000 sq ft adventure park called ‘District 121’and more than 80 restaurants and cafes","Jul 30 2014, 05:38 PM"
234,THE CLIO RESIDENCE @ IOI RESORT CITY ,Babizz,good enough! Putrajaya landed so expensive.. duno what kinda human wanna stay there.. btr just buy condo =),"Jul 30 2014, 08:38 PM"
235,THE CLIO RESIDENCE @ IOI RESORT CITY ,Nidz,I beg to differ. 2 storey terrace house in putrajaya can get around rm600k for 2000sqft size. That's roughly rm300 psf. Is that considered expensive?,"Jul 30 2014, 10:00 PM"
236,THE CLIO RESIDENCE @ IOI RESORT CITY ,Babizz,really ah? I see the new launch all so expensive!Just saw on propwall.. then this condo not BBB lorr,"Jul 30 2014, 10:10 PM"
237,THE CLIO RESIDENCE @ IOI RESORT CITY ,Nidz,"Well, it all depends on you. For me, this condo is BBB coz I wanna stay there.","Aug 3 2014, 12:18 AM"
238,THE CLIO RESIDENCE @ IOI RESORT CITY ,Babizz,thats very good if it's for ownstay.. at least some of the condo units will be occupied when VP,"Aug 3 2014, 08:09 AM"
239,THE CLIO RESIDENCE @ IOI RESORT CITY ,TSaccetera,"It's a Le Meridien Hotel, a brand under Starwood Hotels & Resorts.","Aug 3 2014, 11:50 PM"
240,THE CLIO RESIDENCE @ IOI RESORT CITY ,bigman,Wah..like tat i must follow which ever u buy...cos all will be BBB.... so...ur next target?,"Aug 4 2014, 08:03 AM"
241,THE CLIO RESIDENCE @ IOI RESORT CITY ,Nidz,"For the time being, I can only afford this property. Next purchase may have to wait until I have more disposable income.","Aug 4 2014, 04:38 PM"
242,THE CLIO RESIDENCE @ IOI RESORT CITY ,CKH1988,internal staff booked passed last week if not mistaken...anybody know how's the response?,"Aug 4 2014, 05:01 PM"
243,THE CLIO RESIDENCE @ IOI RESORT CITY ,CKH1988,"besides, how much rental u guys think this Clio can fetch?While Puteri Palma with 1600sf rental is roughly RM2.5k now.means Clio with 800sf ++ can get around 1.5 - 2k only?","Aug 4 2014, 05:20 PM"
244,THE CLIO RESIDENCE @ IOI RESORT CITY ,MNet,It is market demand and supply distorted by capitalism (banks and developer trying to maximise profit) for the malaysian property market for the last 5-6 years. We used to have 6-7% rental yield and slow and steady capital appreciation. But the market just gone crazy. 30% appreciation in a year ! Doesnt sound right unless it is a get rich quick scheme. There are a host of factors which caused the distortion.,"Aug 4 2014, 10:21 PM"
245,THE CLIO RESIDENCE @ IOI RESORT CITY ,kamilnu,Where is the sales office?,"Aug 5 2014, 08:47 AM"
246,THE CLIO RESIDENCE @ IOI RESORT CITY ,eco_supporter,"heard the launch have postpone, any one have insight?","Aug 11 2014, 01:27 PM"
247,THE CLIO RESIDENCE @ IOI RESORT CITY ,bigman,bcos of their skyz residence didnt get good response from market??? shy to launch another new project??,"Aug 12 2014, 07:23 PM"
248,THE CLIO RESIDENCE @ IOI RESORT CITY ,Nidz,"It's located in IOI Resort Putrajaya, the office block is next to the Marriott HotelThe postponed the launch towards mid or end August, due to the Raya holidays this week. Many buyers complained that they cannot make it for the 31st July booking event..","Aug 12 2014, 11:19 PM"
249,THE CLIO RESIDENCE @ IOI RESORT CITY ,Ace Ranger,"So many big big mall opening soon for example Empire Damansara, will it really attract so much traffic or population as there are so much existing shopping centre in the market currently!!!","Aug 12 2014, 11:48 PM"
250,THE CLIO RESIDENCE @ IOI RESORT CITY ,CloudAtla$,"Condo in Putrajaya. If just next to IOI mall, can invest at 500psf.","Aug 12 2014, 11:54 PM"
251,THE CLIO RESIDENCE @ IOI RESORT CITY ,Ace Ranger,Emm but clio lauching at least at 600psf in their Facebook pages,"Aug 12 2014, 11:59 PM"
252,THE CLIO RESIDENCE @ IOI RESORT CITY ,Babizz,Mall failure gona come very soon. So developers better be prepared. many small and not well planned malls will FAILI'm very sure IOI City Mall will succeed due to great potential in Putrajaya/Cyberjaya with thousands of new condo's and new/existing colleges/offices in the area.,"Aug 13 2014, 12:02 AM"
253,THE CLIO RESIDENCE @ IOI RESORT CITY ,CMW123,IOI City Mall should be the most promising mall to open in 2014,"Aug 13 2014, 09:00 AM"
254,THE CLIO RESIDENCE @ IOI RESORT CITY ,Soros007,10th Nov - Grand opening for IOI Resort City Mall - LIKE!,"Aug 13 2014, 09:20 AM"
255,THE CLIO RESIDENCE @ IOI RESORT CITY ,yck1987,,"Aug 13 2014, 10:25 AM"
256,THE CLIO RESIDENCE @ IOI RESORT CITY ,propertybbb,Can Clio walk over to the mall?,"Aug 13 2014, 03:24 PM"
257,THE CLIO RESIDENCE @ IOI RESORT CITY ,ftan,"I would say no. My EU colleagues will say yes as they love to walk long distance under the hot sun.If drive, then few mins only.","Aug 13 2014, 04:03 PM"
258,THE CLIO RESIDENCE @ IOI RESORT CITY ,peyter,No news on launch date?,"Aug 13 2014, 04:23 PM"
259,THE CLIO RESIDENCE @ IOI RESORT CITY ,Nidz,"It is now set for launching this Friday, 15th August.","Aug 13 2014, 04:35 PM"
260,THE CLIO RESIDENCE @ IOI RESORT CITY ,Babizz,"yes with icerink and a few new anchor tenants in the Malaysian market like Homepro, this mall will trump Quill as the best mall in 2014.Duno how empire Damansara is doing but the government should stop issuing licenses to build malls.","Aug 13 2014, 06:31 PM"
261,THE CLIO RESIDENCE @ IOI RESORT CITY ,Nidz,,"Aug 13 2014, 09:12 PM"
262,THE CLIO RESIDENCE @ IOI RESORT CITY ,rainman19,mall create opportunity but meantime create competition,"Aug 15 2014, 12:25 AM"
263,THE CLIO RESIDENCE @ IOI RESORT CITY ,Babizz,looks really good =) 600 ish psf. Anyone knows how many percent discount?,"Aug 15 2014, 02:06 AM"
264,THE CLIO RESIDENCE @ IOI RESORT CITY ,Nidz,5% cash back,"Aug 15 2014, 09:17 AM"
265,THE CLIO RESIDENCE @ IOI RESORT CITY ,Babizz,maybe got more discount during the launch. Got balloting for this?? Product looks good although all amenities are already priced in. I think it won't be hard to find tenants who like to live near malls,"Aug 15 2014, 11:50 AM"
266,THE CLIO RESIDENCE @ IOI RESORT CITY ,Nidz,I don't know if there is further discount. Will check it out today and report it back here,"Aug 15 2014, 12:05 PM"
267,THE CLIO RESIDENCE @ IOI RESORT CITY ,d.storey,Can we go without the invitation?,"Aug 15 2014, 12:11 PM"
268,THE CLIO RESIDENCE @ IOI RESORT CITY ,seanooi880327,872 sqft for 580K is about rm665 psf.Not cheap..If Rm600 psf is reasonable..,"Aug 15 2014, 01:42 PM"
269,THE CLIO RESIDENCE @ IOI RESORT CITY ,ftan,"Wah, walking distance to the ioi phase 2 mall. Didn't know that. When is phase 2 mall ready?Ya, internal staff sapu the cheaper units. The bigger units are just pricey. Friday onwards should be open to public/registrants.","Aug 15 2014, 01:43 PM"
270,THE CLIO RESIDENCE @ IOI RESORT CITY ,Nidz,"Phase 2 of the mall should start construction by mid next year. Same goes to The Connexion (across The Clio), will be launch by mid next year as well. But according to the SA, the earthwork and piling has already started.The Connexion will be a mixed development comprised of 4 storey retail outlets (mostly F&B) and high density (1000+ units) residential tower but of smaller size compared to The Clio. IINM, the sizes are 750 sqft, 950 sqft and 1200 sqft. Pricing is not yet determined.","Aug 15 2014, 01:45 PM"
271,THE CLIO RESIDENCE @ IOI RESORT CITY ,TSaccetera,"Just all information,The Connexion thread is here:https://forum.lowyat.net/topic/3183737","Aug 15 2014, 03:40 PM"
272,THE CLIO RESIDENCE @ IOI RESORT CITY ,Nidz,"Here are more infos on The Clio:1- Booking fees of RM8,000 (admin fees of rm500 if loan rejected)2- Free SPA legal fees (excluding disbursement, around rm350-500)3- 2% rebate and 3% cash back (based on SPA price)4- 2% rebate will be via credit note during delivery of vacant possession (will be used to deduct all other payments that need to be paid upon VP)5- 3% cash back will be paid in 5 instalments. Every 6 months after SPA.6- Balance downpayment can be paid in 3 instalments on the 3rd, 9th and 15th month after signing SPA. Buyer must issue post dated cheques during signing.Furnishing includes:1- 2 units of aircond (living hall and master bedroom)2- Kitchen cabinets, hood and stove.3- Built-in heater for master bedroom4- Digital locksetMaintenance fee (including 10% sinking fund) : rm0.33/sqftPlease note, this development is under commercial title. As such, commercial rates will apply for assessment and utilities. However, seeing that this development is all residential, the utilities provider might allow the use of residential rates. The SA has confirmed that Puteri Palma Condo was under the same situation, and now they have successfully converted the title into Residential.Hope this info helps.","Aug 15 2014, 03:46 PM"
273,THE CLIO RESIDENCE @ IOI RESORT CITY ,xyyap,Putrajaya price?Cyberjaya is so cheap. LOL,"Aug 15 2014, 04:22 PM"
