,thread_name,username,post_content,posted_at
274,THE CLIO RESIDENCE @ IOI RESORT CITY ,ftan,"That's good to know. Once Clio VP, the phase two mall would be almost there or completed. Something to look forward to and I'm wondering how walkable the distance would be.I'm also curious why the Connextion retail is so close to the mall. There would be some competition, right?","Aug 15 2014, 04:45 PM"
275,THE CLIO RESIDENCE @ IOI RESORT CITY ,ibbrio,misleadingnewspaper advert shows from 499k somethin as minand RM552psfnow is 580k onwards???i hate this kind of cheat people mislead advertthey claimed can walk so ...another cheating?,"Aug 15 2014, 04:53 PM"
276,THE CLIO RESIDENCE @ IOI RESORT CITY ,Babizz,maybe that one after bumi discount,"Aug 15 2014, 05:09 PM"
277,THE CLIO RESIDENCE @ IOI RESORT CITY ,bigman,u try to ask the project director or the whole team members of the project to walk from site to the mall...then I will believe their claim..,"Aug 15 2014, 05:16 PM"
278,THE CLIO RESIDENCE @ IOI RESORT CITY ,ibbrio,is location along persiaran utara or inside the boundary?red colour dotted line means ioi resort city?clio is inside or outside boundary??seems cannot paste the pic here google map,"Aug 15 2014, 05:20 PM"
279,THE CLIO RESIDENCE @ IOI RESORT CITY ,viper88,Printscreen and attach it here. sure can,"Aug 15 2014, 05:22 PM"
280,THE CLIO RESIDENCE @ IOI RESORT CITY ,siawengwai,yes...only one unit is 499k,"Aug 15 2014, 05:22 PM"
281,THE CLIO RESIDENCE @ IOI RESORT CITY ,ibbrio,"which unit?next to toilet ah?next to car park ah?even with bumi discount also cannot get to RM 499,xxx","Aug 15 2014, 05:24 PM"
282,THE CLIO RESIDENCE @ IOI RESORT CITY ,ibbrio,anyone gone there yet?called the sales office but nobody answers callsit looks far to the city mall and it is at the edge of ioi land. so behind clio is who? uniten land? view is facing ioi city mall and back view is facing??future development will all be serviced apartments?phase 2 mall normally takes many years to realise depending on the success of phase 1. while waiting for that is it gonna be empty land with sand?,"Aug 15 2014, 05:25 PM"
283,THE CLIO RESIDENCE @ IOI RESORT CITY ,ibbrio,looks like puteri palma is still a better buy; looks nearer to the mall and surrounded by greenery nice golf course,"Aug 15 2014, 05:34 PM"
284,THE CLIO RESIDENCE @ IOI RESORT CITY ,ibbrio,looks like buy for stay first since future development is yet to take place and once all ready and matured it will be easier for rental market,"Aug 15 2014, 05:37 PM"
285,THE CLIO RESIDENCE @ IOI RESORT CITY ,d.storey,How's take up rate? Which one is better investmt between clio and putra residence?,"Aug 15 2014, 06:03 PM"
286,THE CLIO RESIDENCE @ IOI RESORT CITY ,bigman,normally the 1st launch will be cheapest and locate far away...,"Aug 15 2014, 06:22 PM"
287,THE CLIO RESIDENCE @ IOI RESORT CITY ,ibbrio,"cheap meh? RM 589,000 onwards for lowest level oni niahthis is facing uniten and unit does not have yardwhat is uniten view look like?looking at ioi land there, eventual and future launch will probably like skyz puchong high pricing and lack of buyers","Aug 15 2014, 08:37 PM"
288,THE CLIO RESIDENCE @ IOI RESORT CITY ,peyter,"Hi all just , just back from the launch. The following was true at 2 pm at 15.08.20141. Take up rate is impressive : Type C all gone, except for the highest floor unit. You can get a 16th floor Type B at the same time.2. Type B units : Sold out up to 17th floor, unless you dont mind the units adjacent to the Water Tank.3. 5% discount : To be paid out in stages. Forgot the mechanics. Something like 3% up front, and 2% every 6 months.4. Flexi pay : The downpayment can be paid using postdated cheques in 3 payments, spanning 15 months (bit fuzzy here on the details)5. 2 car parks per unit. Fixed allocation6. View available: Type C and B facing uniten, nicer view for the rest.7. Booking fee of RM8000. RM500 fee if your loan is disapproved by 3 banks. Else RM8K bye bye.8. Completion time: 3 years, almost at 20%9.Most banks offering up to 4.5% for loan.","Aug 15 2014, 08:52 PM"
289,THE CLIO RESIDENCE @ IOI RESORT CITY ,chicargo,How about take up rate for Type A and D?,"Aug 15 2014, 08:54 PM"
290,THE CLIO RESIDENCE @ IOI RESORT CITY ,peyter,"At that time, still slow.","Aug 15 2014, 11:37 PM"
291,THE CLIO RESIDENCE @ IOI RESORT CITY ,JamesPond,purchasing power still strong in malaysia.,"Aug 16 2014, 12:17 AM"
292,THE CLIO RESIDENCE @ IOI RESORT CITY ,ibbrio,it is always buy the cheapest gone leaving those pricier for big pocket investor to go ini see is just around the roundabout road there meaning could suffer from road noise once packed,"Aug 16 2014, 01:40 AM"
293,THE CLIO RESIDENCE @ IOI RESORT CITY ,ibbrio,how much is type B at 16th floor?how much type C at highest floor?all price - 5%?,"Aug 16 2014, 01:45 AM"
294,THE CLIO RESIDENCE @ IOI RESORT CITY ,chicargo,"from google maps, seem like a good 200m from main road","Aug 16 2014, 01:47 AM"
295,THE CLIO RESIDENCE @ IOI RESORT CITY ,ibbrio,"so could be a condo on a busy road and have to cross many roads to walk to the mallso if we don't buy now, price keeps increasingso force to BBB this Sunday","Aug 16 2014, 01:48 AM"
296,THE CLIO RESIDENCE @ IOI RESORT CITY ,ibbrio,how much is type D?better view face the mall and golf,"Aug 16 2014, 08:24 AM"
297,THE CLIO RESIDENCE @ IOI RESORT CITY ,peyter,"19th foor Type D:78780019th foor Type A:875800Before discount. Auspicious floors more $$$, those with 4 in it less so","Aug 16 2014, 08:25 AM"
298,THE CLIO RESIDENCE @ IOI RESORT CITY ,chicargo,"I wonder if there is big difference in view between type D -01 and type D-09? both in same direction but sales brochure says one golf view +pool, the other city mall view?","Aug 16 2014, 08:49 AM"
299,THE CLIO RESIDENCE @ IOI RESORT CITY ,peyter,Depends if you like greenery or not,"Aug 16 2014, 09:28 AM"
300,THE CLIO RESIDENCE @ IOI RESORT CITY ,peyter,"Sales person says 1 KM from City Mall Phase 2. If Phase 2 launches that is.If you're planning on buying smaller units, I think Sunday will be bit late.","Aug 16 2014, 09:31 AM"
301,THE CLIO RESIDENCE @ IOI RESORT CITY ,chicargo,is this the correct location? google thinks it is only 300m from phase 2 and 800m from phase 1maybe they mean driving distance (have to go round in circles)? if there's direct pedestrian walkway surely benefit this project,"Aug 16 2014, 09:33 AM"
302,THE CLIO RESIDENCE @ IOI RESORT CITY ,ftan,Did you book a unit?1km is not walking distance as claimed by the advertisement.I like the golf facing view. United view is ok and more quiet.,"Aug 16 2014, 09:51 AM"
303,THE CLIO RESIDENCE @ IOI RESORT CITY ,bigman,mayb ioi try to copy tropicana...which ever launched by developer....buyers just snap wat ever the price offered...but ioi forget...there are different betwwen buyer from puchong/cheras/seri kembangan compared buyers from PJ which richer n dun care..,"Aug 16 2014, 09:56 AM"
304,THE CLIO RESIDENCE @ IOI RESORT CITY ,Nidz,"Both units 01 and 09 are facing the same direction, and have almost the same view. I believe the balcony of these 2 units are around 30 meters apart, so they share more or less the same view. I think categorising it into Mall View and Golf View is a sales pitch.They are building a direct flyover from IOI City Mall into the Clio site. I think it's gonna be around 2 mins drive to the mall. Walking to the mall is possible, but it is around 2km (maybe, I don't know the exact distance).Both side views are nice. If facing the mall/golf course, You can also see Putrajaya and its lake. You will also see other construction/development on this side.Uniten view is more relaxed for me. The buildings are spaced apart, no visible constructions/development sites (as of yet, I don't know if this will continue in the future) you can also see the mountains area from here.I would suggest you guys to go and see the panorama view at the sales office, it is really nice.","Aug 16 2014, 07:42 PM"
305,THE CLIO RESIDENCE @ IOI RESORT CITY ,kamilnu,I smell nothing but flippers in this project. They are still at it. As for for the pricier units.....nahhhh...investors wont be touching those bcos they no they cant get any decent return for it. Those cheaper units are bought by uncle and auntie oso.,"Aug 16 2014, 09:00 PM"
306,THE CLIO RESIDENCE @ IOI RESORT CITY ,brand,Hot sales ???,"Aug 16 2014, 09:18 PM"
307,THE CLIO RESIDENCE @ IOI RESORT CITY ,ibbrio,this kind of pricing makes no difference in getting skyz puchong or anywhere other than putrajayasubsequent launches will be close to 1 mil???no eyes no eyesgreedy developers everywhereyet uncle auntie can just buy like taugehputeri palma 2 subsale now 650k asking price 1400sqft better deal lor..,"Aug 16 2014, 09:54 PM"
308,THE CLIO RESIDENCE @ IOI RESORT CITY ,ibbrio,confirmed? this is at least a sellin point,"Aug 16 2014, 10:20 PM"
309,THE CLIO RESIDENCE @ IOI RESORT CITY ,ibbrio,"lol, who will walk 1km under malaysia weather?mid valley walk to garden end is 1km?? with air condask tan sri ioi walk n see","Aug 16 2014, 11:26 PM"
310,THE CLIO RESIDENCE @ IOI RESORT CITY ,ibbrio,this is why the property market is gettin unhealthyany tom d*** harry becomes developerjust launch and enjoy $$,"Aug 17 2014, 04:24 AM"
311,THE CLIO RESIDENCE @ IOI RESORT CITY ,Kicimiao66cc,Basically Clio consider one of the best residential project within that zone.,"Aug 17 2014, 09:53 AM"
312,THE CLIO RESIDENCE @ IOI RESORT CITY ,Nidz,"Yes, I have been there to scout the project site. It is no accessible by roads yet. And I also saw the flyover, almost completed. Personally, I don't think that I'm gonna walk to the mall, especially under the hot sun.","Aug 17 2014, 10:41 AM"
313,THE CLIO RESIDENCE @ IOI RESORT CITY ,brand,The best ? How about cyberjaya project ?,"Aug 17 2014, 12:41 PM"
314,THE CLIO RESIDENCE @ IOI RESORT CITY ,ibbrio,how to compare? unless you compare address? putrajaya VS cyberjaya?clio leverage on this huge shopping mall. i see this as the only selling point.cyberjaya past launches all mainly target students and working professionals apart from people who buy to stay despite not working there or for retirementcould clio target uniten students? is it within walking distance to uniten from the back view unit?,"Aug 17 2014, 03:50 PM"
315,THE CLIO RESIDENCE @ IOI RESORT CITY ,ibbrio,"flyover is always good like how tropicana city mall created those flyovers connecting to their mall it makes it easier for the community there to enter the mall straight but outside visitors may soon use it too causing congestion into the mall (wonder whether it will be like mid valley kinda death ring into the mall = once you enter the ring, be prepared to jam jam jam)","Aug 17 2014, 04:06 PM"
316,THE CLIO RESIDENCE @ IOI RESORT CITY ,ibbrio,so if miss this clio what is next? there will be more serviced apartments and condos to be launched right? the best has yet to come but with price tag premium??,"Aug 17 2014, 11:22 PM"
317,THE CLIO RESIDENCE @ IOI RESORT CITY ,Kicimiao66cc,Best for current house buying planner. Coming best project is for future house buying planner ya.,"Aug 18 2014, 07:28 AM"
318,THE CLIO RESIDENCE @ IOI RESORT CITY ,ibbrio,which one did you buy? type C? or B?car park is 6-7 floors?; imagine drive up and down daily. damn scary,"Aug 18 2014, 09:54 AM"
319,THE CLIO RESIDENCE @ IOI RESORT CITY ,ftan,"Yup, agree on this. Sales person says phase 1 mall is about 2km and phase 2 about 1km from Clio. They shouldn't advertise as walking distance IMO.Clio leverages on mega mall, golf course & resort environment and future township. All under one developer. The planning is more controlled. I'm not sure if the target is students unless they are rich. If the mall is successful and with the offices, then there is potential tenants there.Cyberjaya has lot of launches already. I think maybe a bit too much and need to be careful in choosing the right product & location. I would still be interested to get one here but I can bide my time.","Aug 18 2014, 10:00 AM"
320,THE CLIO RESIDENCE @ IOI RESORT CITY ,ruben7389,How's ths response n turnout today?,"Aug 18 2014, 10:41 PM"
321,THE CLIO RESIDENCE @ IOI RESORT CITY ,Ace Ranger,I personally thinking that if you have enough bullets can go for largest unit 1410 sqf starting price at RM810k onward before the incentive discount...which will be around RM770k / 1410 =RM546 psfThe price seen so fair...hahah my 2 cents,"Aug 19 2014, 09:20 AM"
322,THE CLIO RESIDENCE @ IOI RESORT CITY ,ftan,"Ace Ranger, you are right. Too bad entry cost is high.ruben7389, morning had some people but not a big frenzy. Probably due to the rain also.I took a snapshot of the sales chart around 11am.Edit: Ai, how to flip the pic? Using my phone now.","Aug 20 2014, 09:35 AM"
323,THE CLIO RESIDENCE @ IOI RESORT CITY ,kamilnu,Still BBB mode i see.....goshh,"Aug 20 2014, 04:13 PM"
324,THE CLIO RESIDENCE @ IOI RESORT CITY ,ftan,"Ya, and that was this morning. There's still tomorrow.I asked the SA and seems most are buying for investment.","Aug 20 2014, 04:17 PM"
325,THE CLIO RESIDENCE @ IOI RESORT CITY ,viper88,Rotate 4 u ady.. nah..Looks good sales.. Puchong nowday also booming.. price like KL ady.,"Aug 20 2014, 04:39 PM"
326,THE CLIO RESIDENCE @ IOI RESORT CITY ,enkil,Wow! Sales still going strong.,"Aug 20 2014, 04:43 PM"
327,THE CLIO RESIDENCE @ IOI RESORT CITY ,ftan,"viper88, thank you!","Aug 20 2014, 04:46 PM"
328,THE CLIO RESIDENCE @ IOI RESORT CITY ,rachel_xxx,"thats very sad, below water tank also sapu","Aug 20 2014, 04:48 PM"
329,THE CLIO RESIDENCE @ IOI RESORT CITY ,ftan,Anyone went today to look see and for the free food?How's the sales?,"Aug 20 2014, 04:50 PM"
330,THE CLIO RESIDENCE @ IOI RESORT CITY ,peyter,"Type C all gone.Type B left 2 at about 12 pm.Type A about 9 left.Only Type D are plentiful.Oh, some good news. TNB rates are residential rates, said one sales person. Water, Quit Rent still in negotiationAnd a little bird told me that prices went up between 1-2% on Friday night.","Aug 20 2014, 04:53 PM"
331,THE CLIO RESIDENCE @ IOI RESORT CITY ,ftan,"Thanks for the info. Did you buy?I doubt it is residential rates as the SA have always said it is commercial rates. Maybe they will help convert once VP.Hmm, didn't check the prices yesterday. If 1-2% increase on already high prices imo, then really .","Aug 20 2014, 04:57 PM"
332,THE CLIO RESIDENCE @ IOI RESORT CITY ,Ace Ranger,"You sure that the type D is plenty? Or the type A with biggest size?Type D only 50 units wor, but type A is about 200 units","Aug 20 2014, 05:03 PM"
333,THE CLIO RESIDENCE @ IOI RESORT CITY ,peyter,"Oops. You're right . The second largest ones have bout 9 units,While the largest ones are plentiful.","Aug 20 2014, 05:08 PM"
334,THE CLIO RESIDENCE @ IOI RESORT CITY ,ibbrio,"so it is an almost sold out project within 3 days despite the high pricing.there is a mosque at the back view (face uniten)wonder whether front view will be obstructed by future construction of tall buildings blocking the view of a golf course and the mall.a property within 1-2km from a mall will get push super high in capital appreciation or more for staff who works in the mall to rent?type A is cheapest in psf and they have more of this type but affordability remains the key which many developers continue to ignore.IMHO, it is ridiculous and rubbish to just increase 1-2% during the preview.there is no justification for that except speculation; developer is speculating and buyers are speculating. in the end, the property market gets distorted.","Aug 20 2014, 05:16 PM"
335,THE CLIO RESIDENCE @ IOI RESORT CITY ,ibbrio,"so today it is still continue to look like a seller's marketany developer can simply launch, sure got the newly coined word ""waterfish"" to buy haha so developer can do what they like on a whimdeveloper gets richer and the citizen gets poorer by committing to a never ending debttan sri: how's the sales today?staff: not badtan sri:so let's increase 3% tomorrow to fish for more waterfish","Aug 20 2014, 07:35 PM"
336,THE CLIO RESIDENCE @ IOI RESORT CITY ,Ace Ranger,"There will always the willing seller and willing buyer in the market...investors have their own preference in term of neighbors, location, price, environment and etc...they can always go for KL area with smaller size unit with same price...so no right or wrong purchase (water fish) in my view...just m2c again 😅","Aug 20 2014, 07:56 PM"
337,THE CLIO RESIDENCE @ IOI RESORT CITY ,ibbrio,"correct. i was just picking up the new word being used in the forumpeople have been made to think that investing in a property = easy money. no need to work. just buy and sit which has led to ""BBB"" mentality. hence there will always be buyers for every property launch but most of the developers who continue to sell at high price will find it harder to sell and similarly upon VP by the buyers.actually a lot of genuine buyers out there who are still looking at their first property; but with the current ""crazy... no justification"" pricing it makes no sense and it makes people heavily in debt servicing the good margin bank loan. so developers and banks profit the most. when people try to do the same by flipping, it makes ordinary people suffer for no reason. people keep comparing that malaysian properties is cheap. i hope there is a correction in property pricing soon. our wanton mee also won't suddenly jump to RM 10-15 per bowl. it is acceptable to have inflation but reasonable growth. not like what happened suddenly to the properties pricing now.","Aug 21 2014, 09:23 AM"
338,THE CLIO RESIDENCE @ IOI RESORT CITY ,norman05051984,"couldn't agree more. I'm looking for first home also facing difficulty to find a house within my budget. Last week, i viewed an apt, ground floor, the owner wants to sell it @ RM290k. I nego until RM270k.Next day, i went to few banks to get indicative valuation report and guess what all 4 banks i asked, they gave me valuation around RM210k - RM230k. And when told this to owner, he die die wants to sell it @ RM290k bcos unit above him sold about RM260k.I'm not willing to topup more, so asked for RM245k max. So waiting games begin...Moral: malaysian property price is too bloated with artificial pricing and waiting to collapse under its own weight.","Aug 21 2014, 11:48 AM"
339,THE CLIO RESIDENCE @ IOI RESORT CITY ,ibbrio,"inflated prices...if you can wait, wait...see how the seller respondsif every buyer holds then we can sure see changes to property pricingafter all, it is ground floor and subject to noises and people walk here and there (less privacy)i would say follow bank valuation if possible as it helps with the loan amountasking price is always ....asking price oni nia...","Aug 21 2014, 03:26 PM"
340,THE CLIO RESIDENCE @ IOI RESORT CITY ,ESBI_E,"-> slow slow wait...- > Rule of thumb, in principal, the market is driven by demand and supply basis.No easy money, it is no equivalent but most prevalent long term type of investment asset either for nation / individual. Thanks to the Inflation hike, chain effect brings to so called collateral price appreciation.Instead of putting blames on developers and bank profits the most, why don't the individual thinking of how to get yourself motivated, and find ways to contribute more and hence strengthen up your affordability.","Aug 21 2014, 03:47 PM"
341,THE CLIO RESIDENCE @ IOI RESORT CITY ,ibbrio,"haha yes wait wait and work hard hard now to increase wealth to buy more but both government and developers gotta understand their rakyat (the majority of the people, the masses)","Aug 21 2014, 03:56 PM"
342,THE CLIO RESIDENCE @ IOI RESORT CITY ,tongyk,slow slow wait too,"Aug 21 2014, 04:06 PM"
343,THE CLIO RESIDENCE @ IOI RESORT CITY ,ESBI_E,"Work hard - past tense ; work smart - present tenseUnderstanding is on mutual, Rakyat should be understandable too. We are living in the world of capitalism mechanism..and how capitalism could prove benevolent to the human race... gotta face it ler.","Aug 21 2014, 08:21 PM"
344,THE CLIO RESIDENCE @ IOI RESORT CITY ,ibbrio,did you buy this esbi?what you think? cheap project?this forum is kinda quiet compare to other forumwhat happened?some forum non stop talking daily,"Aug 21 2014, 08:41 PM"
345,THE CLIO RESIDENCE @ IOI RESORT CITY ,ESBI_E,"Nothing is at certainty. Embrace for uncertainty, that's my certain.","Aug 21 2014, 09:30 PM"
346,THE CLIO RESIDENCE @ IOI RESORT CITY ,ibbrio,bro you are a philosopher ah?haha,"Aug 21 2014, 10:08 PM"
347,THE CLIO RESIDENCE @ IOI RESORT CITY ,ibbrio,work hard+smart = future planet/space tenserakyat try to understand but cannot catch upjust ask your friends who just come out to work with a degreecannot copecannot buy ler...unless become entrepreneur and the success onehow many of this? very little,"Aug 21 2014, 10:42 PM"
348,THE CLIO RESIDENCE @ IOI RESORT CITY ,chicargo,"ibbrio did u buy?quiet because of either 2 reasons:1. buyers are very senior, do not know the existence of this forum2. there's nothing to discuss, just wait for the mall to open doors. They are lurking in other topics","Aug 22 2014, 12:09 AM"
349,THE CLIO RESIDENCE @ IOI RESORT CITY ,ibbrio,truemost investors / buyers do not come to forums because they are busy making moneyno time to writebesides they find it unnecessaryi think mainly analysts in many of the forums and too much analysis leads to paralysisnot yetchicargo did you buy? which type?,"Aug 22 2014, 12:15 AM"
350,THE CLIO RESIDENCE @ IOI RESORT CITY ,chicargo,"I gave it a good thought, but only higher units available (psf more than RM650, can't justify)But I am keeping a close eye on IOI resort city and their future launchesmeanwhile in the news: http://msn.iproperty.com.my/modules/news/r...s.aspx?nid=9113","Aug 22 2014, 10:41 AM"
351,THE CLIO RESIDENCE @ IOI RESORT CITY ,ibbrio,"as usual, pricing for future launches as claimed by sales team will be even higher but there may be more chances (higher density) to grab cheaper units with smaller sizes since this clio is supposed to be low density so there is a premium; however location is not that premium as it is along the road may face noise pollution","Aug 22 2014, 11:13 AM"
352,THE CLIO RESIDENCE @ IOI RESORT CITY ,MNet,how much u need pay bank valuation fee?,"Aug 22 2014, 11:35 AM"
353,THE CLIO RESIDENCE @ IOI RESORT CITY ,ftan,"Probably #2. I can't wait for the mall to open. Got quite nice tenants from their FB.Next ioi launching should be the Connextion. If launch after gst, will be priced higher, right?","Aug 22 2014, 11:46 AM"
354,THE CLIO RESIDENCE @ IOI RESORT CITY ,norman05051984,"i just asked for indicative valuation fees from various bank listed below:CIMB : 220kMaybank : 234kBank Islam : 210kBank Mualamalat : 240kRHB : TBCAmbank : TBCto answer your Q, since it's indicative its free. Im still playing tarik tali with owner to agree with bank's MV rather to agree with his absolutely crazy price.","Aug 22 2014, 11:50 AM"
355,THE CLIO RESIDENCE @ IOI RESORT CITY ,ibbrio,"market understanding is ... ""higher""; that is why so many property talks with speakers saying buy now. buy buy buy. please buy buy buy. taugeh is fresh now. please buy buy buy. buy later price is gonna be higher. but what we don't know is the developer cost structure (unless they show us before and after GST impact item by item) and their profit margin, and...how they play. a lot of factors in how they price the already high priced property. so even you buy today, you never know whether they have priced the GST inside (to have buffer for their future material costs).IMO, there is no need to rush before GST. it really depends on why you want to buy today. so i am still looking at this ioi resort city development waiting for price drop pray durian drop from sky","Aug 23 2014, 09:42 AM"
356,THE CLIO RESIDENCE @ IOI RESORT CITY ,Nidz,"With regards to GST, I think that current new developments/projects have already factored in the increase of materials prices. GST will be launched next year and this project will need 3 years for construction, but the contractors won't buy all the materials they need now. They will buy it in stages as well. So, any price effects due to GST must be factored in right now, or else their margins will be lower.","Aug 23 2014, 01:07 PM"
357,THE CLIO RESIDENCE @ IOI RESORT CITY ,ibbrio,"nidz, you wanted very muchdid you manage to sapu 1 unit?many went there to buy the smallest sqft but too late liao...","Aug 24 2014, 02:28 AM"
358,THE CLIO RESIDENCE @ IOI RESORT CITY ,Nidz,"yes, i bought the biggest unit at the 2nd floor. including discounts, my per sqft cost is around rm550.","Aug 24 2014, 06:36 AM"
359,THE CLIO RESIDENCE @ IOI RESORT CITY ,ibbrio,type A more value psf as calculated but 2nd floor is close to the road(whether noise is loud or not in future).congratulations to owning a unit in clio at 775Kthis price was only for type B at high floors so your bigger unit is better deal,"Aug 24 2014, 07:44 AM"
360,THE CLIO RESIDENCE @ IOI RESORT CITY ,Nidz,"i dont think noise will be an issue. as you may know. the first 7 floor in clio are parking area and the facilities floor. so technically, 2nd floor for the unit is already at the 9th floor of normal building. plus, the road infront of clio is not the main road to putrajaya. from the main road, you have to go inside for a further 300-500m before you reach clio.but yeah, im comfortable with my decision.","Aug 24 2014, 07:53 AM"
361,THE CLIO RESIDENCE @ IOI RESORT CITY ,eco_supporter,"how you get the indicative price from all this bank?? can share?? now really need to check with bank 1st before talk to owner, their asking price alway rocket high!!","Aug 26 2014, 01:22 PM"
362,THE CLIO RESIDENCE @ IOI RESORT CITY ,Ace Ranger,Second floor facing which view?,"Aug 26 2014, 01:28 PM"
